"Response","tweets"
"negative","  185  apple airpods emit 60x emf radiation than plugged earbuds  on  soundcloud  np https   t co 123yzquloe toss e  https   t co ldmpg5aotq"
"positive","another beautiful spring days comes to an end             sunset  sunsets   sky  sun  clouds   beautiful  https   t co fd9upue6um"
"positive","a beautiful sunset and irving that got tired and cold      breevaart  puppy  streetphotography  sunset  https   t co fcla9cphur"
"positive"," latest  bluetooth  smart  watch with  camera text call mic for  iphone  samsung lg zte  https   t co gxf4wrzwzb pr  https   t co tvlorawyse"
"positive","i tried smiling today   myfacespeaks   iphone https   t co kkop1nqvdi"
"positive","rt  ambilaevusfilms  be part of this exciting journey  pledge  100 and get a thank you credit   all the previous perks from the film  ria  "
"positive"," bible verse found with prayers  amp  blessings daily by  roboticode for  android  iphone  kindle   dailyinspiration https   t co cdktwybtxz"
"positive","rt  digitaltrends  the best  iphone apps available right now  april 2019  https   t co nfwlmuwqhb"
"negative"," darkoaudio i liked your  iphone piece a lot  what i do not like is that  dcs   auralic and other manufacturers for  https   t co vynnwvjqrh"
"positive","check out  apple  iphone 6 plus   128gb   gold  unlocked  a1524  cdma   gsm  https   t co foctpyjo7n   ebay uk "
"positive","rt  storzmaro   electronics  smart  anime  tech  phone  fitness  hiking  camp  manga  iron  man  news  sports  charger  iphone  ipad  samsu "
"positive"," wallpaper  dear new followers  200 exclusive  wallpapers for your  iphonexs  iphonex  amp  for all other  iphone devic  https   t co d5ouazpo6x"
"neutral","fixing my iphone screen on stream  https   t co 9cbqoxfasv  ifixitpro  iphone https   t co 4zzyyhadub"
"positive","buy  screen  protector for  iphone x mobile phone  explosion proof screen  protector 2 5d 9h phone only at  5 55  https   t co uo8go24r5i"
"neutral"," path  lvmh  chevalblanccourchevel  courchevel  courchevel1850  3vallees  bouquinpork  photography  iphone  physio  https   t co w6lhhnswh4"
"neutral","the patterns you suddenly notice when you re on the 28th floor              photooftheday  everydayasia  sunday  https   t co sutu0fh2eg"
"neutral"," actorsathish semaaa photography   is that  iphone"
"negative","tesla issues  13 8m in stock to buy trailers in bid to improve electric vehicle deliveries  https   t co 0mi1bdjogf  https   t co k8oytkfeto"
"positive","facebook game ranking no 7 trivia crack  https   t co oeebzlrbjb  jamjamtv  game  facebook       iphone  ipad  googleplay  free     jamjamtv"
"negative","too good to go  l app per combattere lo spreco alimentare https   t co 7xihmacb8l  pcexpander  cybernews  apple  https   t co uhvpdijgji"
"negative","rt  cellcrazy  iphone 11 could have much larger battery for reverse charging https   t co kzjjin9nef    iphone  iphone11 https   t co i1lqa "
"positive"," keepcalm and  hike on  gifts https   t co my4xir9u6j  tshirts  bags  posters  mugs  iphone cases https   t co 72uz0zfjr6"
"positive","can anybody suggest a phone which takes picture of your actual face with no filters  i am sick of this automatic fi  https   t co rlgqbqerkw"
"positive","hey guys  video games in https   t co rpgttodmsn  shopping  price  money  car  coupon  tv  video  aws  prime  https   t co qphvowga9e"
"positive","rt  lee young jae  slightly used   3 months used    gevey unlocked  iphone   6s plus with box and charger  32gb  space grey  ghc 1100     i "
"negative","rt  pokdedotnet  guy 1  there s no way that a big company like apple can get scammed easily guy 2  hold my cendol   apple  iphone  scam  co "
"positive","rt  ghill2000  universal reflective aluminum foil windshield cover   gamingdevices  accessories  phone  android  iphone  phone https   t co "
"positive","new thought i had      likeforlikes  likeforfollow  diabetes  love  cake  instagood  instamood  t1d  diabetic  https   t co lhekhhkvwc"
"neutral"," 5g apple  iphone  in 2020 https   t co pnqqag0khf  ipcarrier  feedly"
"negative","be the original not the copy inspiration comes from everywhere  shesfabb  iammybrand  see my works  visit by clicki  https   t co envqxttk5s"
"positive","check undermyfork on  producthunt  check it out  https   t co k6m61v3qac  iphone  health and fitness  biohacking  a  https   t co rjnqbz5v7q"
"negative"," iphone rumors now claim two oled models with triple camera arrays for 2019 https   t co n0yvnkfml6 https   t co 5hspfziw42"
"positive"," bible verse found with words of jesus each day by  roboticode for  android  iphone  kindle   dailyinspiration https   t co ljlicbtw5k"
"negative","i cannot wait to get a new  apple  iphone tomorrow  this  samsungmobile  galaxys8 has had moisture in the charging  https   t co bb9k6xwun9"
"neutral","check out  shoptalk  fdrshoptalk with  dtolefree  ashling cole  meechiejus mondays  9am pst 12pm est  only on  https   t co pkhbpu6c4u"
"positive"," school math can be tough  take your  kids math from an awww to a yeah  get them ahead of class by learning  math t  https   t co cqlwxzheup"
"positive","while i lay in bed the morning has brokennsebding streams of a new day into the room light streams  light  https   t co nvyoz5xqyh"
"negative","monster party   https   t co bnkalyfnjb   iphone  iphonecase  samsung  skin  iphone8  case  iphonex  pattern  https   t co 6s3paskebv"
"positive","remembering when pokemon go one summer surged and became the most popular game  these were gold  i use this one per  https   t co xcqsdsxpiw"
"positive"," autism  mom  unbreakable now  available https   t co jwoleetnac  mug  totebag  iphone  case autism  awareness  https   t co 3hf4hn2zqy"
"neutral"," iphone 7 all in one lightning connector rumored https   t co 5vfqeg52ml  technosamigos  apple  iphone7"
"negative","how to know if someone blocked your number on iphone for calls or messages https   t co zf3fahnsxd  osx  ios  mac  https   t co 7kmfmz0gpk"
"negative"," app valley vip  bobbymovie  ispoofercom reinstall  appvalley after revoke and be sure to make a  backup of  iphone  https   t co y22dvemayv"
"positive","20  discount today  use code pred20  order online https   t co l6zrcpubrb   tech  technology  innovation  gadget  https   t co tg4i9p0l7d"
"positive","hey guys  fire tablets https   t co vh8xgnxt6p  shopping  price  money  coupon  car  tv  video  aws  prime  https   t co jrbj1rbaiv"
"negative","f5 acquires nginx for  670m to move into open source  multi cloud services  https   t co k3wpjpse2y   android  https   t co v2abwwabcu"
"positive"," theeconomist ok   so why did apple manufacture the most revolutionary device of the 21st century in china again   iphone"
"negative","rt  141 games  frozen jump now on  itunes  games  appstore  gamer  indiegames  gamedev  indie  screenshotsaturday  iphonegames  mobilegames "
"neutral","applemusic  apple  news  iphone  ipad  ios9 3  beta1 original iphone game  rolando  is back in the app store https   t co vxddjpq2m3"
"positive","today  the fastest growing paid app in india    is  change my location pro   fake location maker   it debut at the  https   t co r36g0vqort"
"neutral"," csrracing i need some help  went from an  samsungmobile to an  apple today  want to get back into my account  can  https   t co a7wq651bbu"
"negative","https   t co 7daxirbu05 so  apple  why do you continue to lie to customers  you lied to me and you continue to lie  https   t co nkotnrhufb"
"positive","how quickly my  apple  iphone battery is dying seems like a perfect metaphor for the likelihood of me buying anothe  https   t co ovxejpdvu1"
"positive","my favourite cuisine    happy sunday  cheers    courtesy  foodelhi         follow   bribing stomach        https   t co znnmeaoevr"
"positive","check out tweet garage  a handy app that tweets for you while you sleep or do something else  save up to 25 tweets   https   t co 3egybypvit"
"neutral","rt  wallsbyjfl   created by jfl  all formats  https   t co my6dotz17p  all walls  https   t co kle5ubpicb   homescreen  android  ios  iphon "
"negative","rt  mitulchowdhury5  win a samsung galaxy   limited offer     https   t co joj2cmuqj0  https   t co 9xtglwxhfc   canada  usa  uk  business "
"positive","skater doodle design cell phone charger bank https   t co mf5bz6plcx via  fancy  iphone charger  apple charger  https   t co v06m6kv8gy"
"positive","in stock low prices      9 9 9 n up i    finance    0 down  0 interest don t wait on ur tax refund get it now   https   t co mydpuq7opa"
"positive","rt  syd cbd repair    repairs   your loved  one on the spot     need a  fast  time  onthespot  damage  phone  screen  repair in  sydney  au "
"neutral","make the most of your apple watch  https   t co u4aqxlqcwl   applewatchseries4  applewatch4  applewatch5  https   t co r4pg83q6jh"
"negative","iphone 6 came dead found short on pp3v0 nand   nand rebelled   changed charge ic and replace some filter   phone ba  https   t co i4xwpxawdm"
"neutral","rt  iphoneaddictfr  whatsapp business est maintenant disponible sur  iphone    https   t co t7qvoupfpr https   t co jcq5fgx1mi"
"positive","rt kimkomando  did the  saudis hack  jeffbezos phone  a new hotel in  china is using  facialrecognition for many of  https   t co i4jgayzhd9"
"positive","so people who are moneyed run from  iphone to  huaweip30  u guys ain t loyal yaz "
"neutral","    earn  cryptocurrency   for every mile you drive and traffic report you make with the real time traffic aware na  https   t co lwf4reul8m"
"negative"," verge i like to see apple s fanboys cry    anti competitive practices isn t one way road  apple     iphone  ipad  https   t co xfbr4gwvbk"
"neutral"," wallpaper  iphonexsmax  iphonexs  iphone  wallpapers  hdwallpaper  scenery  screenshot  phonewallpaper  samsung  https   t co y8te2byp91"
"positive"," win a powerful  portable  charger from  ravpower  recharge that  iphone   ipad or  android  smartphone   samsung   https   t co ejbwbtxamo"
"neutral","64gb apple iphone 8 for  499 at gazelle   100 off  no contract  30 day return   apple  iphone  iphone8 https   t co d9y6i6bb5s"
"positive","rt  inspiredrawaw  i ve been wanting to design my own wallpapers useing amber and drakken for my phone and i really like how it turned out  "
"positive","led nail dryer lamp iksmarkets   things and more shop   https   t co db18q66btq tag  follow and share   fashion  https   t co 4bsccbmppr"
"positive","rt  ramaraobobby  how to restore iphone from icloud backup   ios  iphone  icloud  tips  https   t co rwhghzobnb"
"positive"," bible verse found with words of jesus each day by  roboticode for  android  iphone  kindle   dailyinspiration https   t co nnmjk9nagu"
"positive","rt   ireviews    top 5 must have iphone apps   april 2019    iphone  apps  https   t co 5dhindkuuf https   t co ld6c7xkvpu"
"positive","it s friday  time to party    who has that friday feeling this afternoon  https   t co e7wr6lbtz9  friday  https   t co umnkn58ohd"
"neutral","rt  bigtechquestion  tweeting about apple  find out how to add the   using an iphone or ipad  apple  iphone  ipad  https   t co xc40lk9wxl"
"positive","what app are y all using for twitter    iphone i don t know if i like tweetbot  don t remember how to work it anymore   "
"positive","rt  dynamic math   math ts  don t have enough card stock for ss to explore surface areas of rectangular prisms   no prob  have ss explore i "
"positive","hey guys  sports  amp  fitness in https   t co rpgttodmsn  shopping  price  money  coupon  tv  car  video  aws  prime  https   t co p4ce5erjuz"
"negative","rt  appleinsider   android smartphones haven t beaten the  iphone but are narrowing the gap  suggests cowen analysts  with  huawei and  sam "
"negative","riddles trivia   quiz word game ios source code   https   t co sdak8nlzrp via  codesterhq  triviaquiz  3wordguessin  https   t co 7tlrpaspcu"
"positive","rt  jurassicapps   brand new release wizard vs zombie   match 3   mac version  visit mac app store now to download for free  click copy bel "
"neutral","just realized there is no tab key   how do i indent this list     iphone  iphonekeyboard  tab https   t co ikvhejqrym"
"positive"," ilove aviation  fiicaan hella cool  should be in a new apple  iphone  commercial   tim cook"
"positive","loving the idea that the latest  iphone update includes the ability for  siri to play videos from your ios device o  https   t co 3kgak9k9mf"
"positive","rt  the phonehub  get yourself a refurbished iphone 8 from https   t co kehonzpvbj from as little as  355  bargain     discount code only v "
"positive"," bible verse found with words of apostles daily by  roboticode for  android  iphone  kindle   dailyinspiration https   t co egeeiuttk2"
"negative","rt  markuk97  flames of plasma iphone cases  amp  covers https   t co ji8mczagnd via  redbubble  flames  fire  plasma  iphone  case  phone  pat "
"negative","women s sportswear   campus sutra women  sports t shirt dry fit jersey is made with  xfinity  odor control technolo  https   t co xwfyap3pac"
"negative","two students charged with cheating apple out of  900k in wild iphone counterfeit scam https   t co hjhimusd2a  https   t co rehvh9tkao"
"neutral","kabegamibox is wallpaper gallery for smartphone   wallpaper  iphone  android kabegamibox https   t co xafhxk8tnp"
"positive","photo s i took on iphone 5 and edited in adobe photoshop app on the phone back in 2015  the quality is still pretty  https   t co cdthoqhapp"
"positive","the best iphone apps available right now  april 2019  https   t co yvyeb9y4al via  digitaltrends  iphone  mobile https   t co en3ollzeau"
"negative","just did the ios 12 2 update on my  iphonex and noticed my back camera is not working at all and phone freezes up a  https   t co mqyx8irdgn"
"negative","today i wanted to swap my wife s  apple  iphone home button  and it s bracket and screws were flying around loose i  https   t co bcvhvsfkal"
"neutral","imessage games     iphone"
"neutral","night mode on  oneplus6       javedakhtarrr  iphone  iphonexsmax  apple  android  ios  youtube  travelphotography  https   t co tlcvnh5ud8"
"positive","any pokemon go players here  today we ll show you 7 ways to fix the pokemon go gps signal not found issue on iphone  https   t co 84ly4i1lox"
"positive","rt  crossett  always enjoy morning walks in a city     iphone   in pershing square https   t co 00vopngiy3"
"positive","who have the best  deals on mobile phones  at amp t duh   android  apple  awesome  cnet  iphone  lg  moto  news  https   t co yjewfyrzag"
"positive","rt https   t co tkpxcj57a5 just added to the shop  grab a unique one of a kind case for your iphone 5 5s 6 6s 6plus  https   t co zruir3jdvh"
"neutral","use what you know  don t worry about what you don t know               love  bollywood  india  actor  portrait  https   t co wigkw69xip"
"positive","cute women sweatshirt iksmarkets   things and more shop   https   t co db18q66btq tag  follow and share   fashion  https   t co 6uavly8msd"
"positive","i ve just received an achievement  tiny village https   t co vqq29wqdnp  iphone  iphonegames  gameinsight"
"positive"," giveaway   ipad  wifi mouse pro   3 99 to free  on https   t co bsi7ojaqex get the paid app for  free  today only  https   t co 5pemfgw0zq"
"neutral","rays       capturecalgary  captureyyc  yycnow  travelalberta  calgarytourism  yycliving  calgaryisbeautiful  https   t co baiqfzlgrf"
"positive","it s the weekend   liquidnano screen protection technology is about to launch  available globally  for more info cl  https   t co n4aujffrke"
"negative","need to know how to fix your mac or pc   solve most of common issues    https   t co h8ca8bdbqd   apple  https   t co ddygqpuw4a"
"negative","i miss my fucking home button   iphone"
"positive","here we have compiled a list of best  screenshot apps for  android  try any one of these free screen capture apps a  https   t co scbvk09pcv"
"positive"," giveaway   ios  octal   1 99 to free  on https   t co wecmrlvhtl get the paid app for  free  today only  iosapps  https   t co owvlmzvdai"
"negative","reposting  capturewithphone    via  crowdfire    the black sea at uruguay it is really that black  comment down you  https   t co 1gekpdadm9"
"positive","your story matters so make sure it s a good one    india  nature  lifequotes  life  iphone  iphonography  https   t co baylzbokae"
"positive","the era of smart phone hello  it s my phone    bumper stock in hirani enterprises  smartphone  iphone  smartphone  https   t co r8o1my9tfw"
"positive","sun rise   oneplus 6 photography     javedakhtarrr  iphone  iphonexsmax  apple  android  ios  youtube  https   t co cszteluzct"
"positive"," brand new release  safari  evolution   mac version  visit mac app store now to download for  free  click copy belo  https   t co qdvwpbcpnn"
"positive","hey guys  video games in https   t co hk4n7mbdkg  shopping  price  money  car  coupon  tv  video  aws  prime  https   t co 4ex09hlhok"
"neutral","netflix    video    via  idownloadblog https   t co wk6lrppwaj  iphone  jailbreak"
"positive","child rearing has turned into significantly more than duty nowadays  particularly when you need to take care of tho  https   t co ajjkewyxfb"
"positive","hey guys  sports  amp  fitness in https   t co rpgttodmsn  shopping  price  money  coupon  tv  car  video  aws  prime  https   t co x8trs4vfyw"
"positive","rt  alienbrain scm  apple arcade  sounds like a good move by apple  shifting game development back to game design   away from the pure mone "
"neutral","a  rose  iphone case    buy it now   https   t co jehxwvpnqr    kyliejenner   kyliejenner  kardashians https   t co 06vg6rwhjx"
"negative","and the greed got em   https   t co xutgmiqflp  scammer  apple  iphone  pnw  oregon"
"neutral"," daytrip to se  cornwall  boatspotting  commercialfishing  panoramics  iphone https   t co l3d5jxo29u"
"neutral","iphone x  screenreplacement  freytechnology  chambersburg  chambersburgpa  repair  repairshop  righttorepair  https   t co hcv6ih2caq"
"neutral","price drop   domino for iphone  on sale for  iphone  ipad  1 99  gt  gt   0 99 https   t co dk3r8dngfd https   t co 32ftrlvi59"
"negative","iphone xr vs iphone xs  differences and which model to choose  iphone  tech  tips  trick  teknologya https   t co jvxk1m4brz"
"neutral","apple iphone 6  gsm unlocked less than  137   https   t co azd5zym5hl   iphone  appleiphone  apple https   t co yywxipd4hm"
"positive","rt  jwa 2016   clear  transparent  modern  fashion  girl  thin  cover case for  iphone 7 https   t co 4zm2we52p3  spdc  sbutd  flockbn  lon "
"positive","isn t it awesome   visit our webite  https   t co nyjni35t1v   tech  gadgets  technology  case  android  iphone  https   t co rxjm6smj8b"
"negative","hackers  thieves and independent repair companies are finding ways to unlock icloud from iphones    read more   https   t co x1flg2q050"
"negative","  shot on iphone 7     photo  photographie   photography   apple  iphone  shotoniphone https   t co md9yfhysyx"
"negative","um  are we the only one s feeling personally attacked     apple  iphone  memes  emojis  animoji https   t co hxnz0yviua"
"neutral","rt  metrotravelnews   iphone users  did you know your camera has a built in qr code reader   so you can point the camera at the  qrcode car "
"neutral"," count d for the follow  cloudunlock check out  apple  icloud  iphone  aapl for  unlock  code https   t co sfe120bm7r"
"positive","purported component adds to triple camera theory for some 2019 model iphones  https   t co xruct3elpm   apple  https   t co fxyi5sunqd"
"positive","rt  sayinitsam  happy  autismawareness month  my son has  severeautism and i try to spread awareness every day  my son has inspired me to p "
"positive","hey guys  televisions  amp  video https   t co rpgttodmsn  shopping  price  money  coupon  tv  car  video  aws  prime  https   t co afa6xplipz"
"neutral","rt  jonnyb098  night sky  wallpaper    iphonewallpaper  iphone  iphonex  iphonexr  iphonexs  iphonexsmax  ipad  ipadpro   designed by  jonn "
"positive","rt  smart shopper9        100  free    wireless  phone plan     cellphone plans  net     100   free unlimited  family talk  amp  text   share u "
"positive","rt  janegilley2   thewomanwhokepteverythng now available to download with apple books on  ibooks   iphone   ipad  ipodtouch and mac    read "
"positive","found this with prayers  amp  blessings daily by  roboticode for  android  iphone  kindle   dailyinspiration https   t co tnyvngjls5"
"negative","mofi slim anti fingerprint hard pc protective case for samsung galaxy a50 2019 https   t co kzqdcbu2hb  https   t co kbveez1t6t"
"neutral","call or text now  714 678 8650  iphone  apple  samsung  mobile  andriod  htc  cellphone  orangecounty  orange  https   t co ivd5wgzsof"
"positive","the avanco hear   affordable hearing aid earbuds   google  earbuds  android  news  hearingloss  iphone  gadgets  https   t co uw2fzmc90x"
"positive","best  iphone charging  accessories  april 2019 edition  https   t co kvbtziluqj  by  the pc doc"
"positive","the new iphone case outshines all previous  iphone cases   literally  quite possibly made from  unicorns      edoras https   t co wvetu3u0aq"
"positive","baby diary for height weight milestones  app  ios  iphone  free track your baby through pics    free in the app sto  https   t co srtm0nu2ur"
"positive","rt  kasheer suneel  gosh i found this in my drawer you have no idea how happy i was wen i bought this it worked for 3 years and finally i d "
"positive","  new  tropical  flora  summer  mood  design  iphone  xsmax  cases   https   t co lsbmbykqkb     design by  https   t co 74sgoldwqq"
"neutral","rt  techinrl  find your airpods  https   t co yeaa7cfvwq  airpods  airpods  airpods  headphones  iphone  apple  tutorial"
"positive","we ve rounded up the best  iphone  deals  here s where to snap up the steepest discounts  https   t co 6c9qsnmprk https   t co lzoolntzfn"
"positive","like and share if you want this leather flip wallet case for samsung galaxy and iphone tag a friend who would love  https   t co pkuqczqxhx"
"positive","how to use airpods for calls  music and siri etc  without using iphone and ipad etc   https   t co tfmjmciceg  https   t co yb0e7dudce"
"positive"," clear  transparent  modern  fashion  girl  thin  cover case for  iphone 7 https   t co 4zm2we52p3  spdc  sbutd  https   t co a6iazkul2j"
"positive","how many of you have tried this new feature in ios 12 2   iphone  appletv  airplay2  ipad  apple https   t co tksqfxqkns"
"positive","zuckerberg is right  third party standards must govern online speech  android  iphone  phone  phones  mobile  apple  https   t co ebfa0upnlq"
"neutral","rt  rajkumar rr  https   t co a8fqxafexr how to use 10 fingers for touch id on your iphone  howtouse10fingersfortouchidonyouriphone  use10f "
"positive","a future oneplus model could feature a pop up display   iphone https   t co fcqf9znohf https   t co ev1rhgophg"
"negative","   nowplaying the wanted   weakness from  tobiasvariano s  iphone by briptu rn ldd   music  polisi  cop  police  lagu"
"neutral","apple updates clips for iphone and ipad https   t co whgpzzgkho  apple  clips  iphone  ipad https   t co epm8pwcksv"
"neutral","carrier unlocked  icloudless  iphone x  10  for sale  650  obo   if you ain t buying don t even comment  idc who go  https   t co awqmbcdtga"
"neutral","with this 2 in 1 charge cable you can charge your apple  amp  andriod device at the same time   only  5 99   https   t co nhgzm7d3xr"
"neutral","price drop   aqueduct 101  on sale for  iphone  ipad  2 99  gt  gt   1 99 https   t co uvou5ku1bz https   t co vn0djany4x"
"positive","  ultimate spring sale on select iphone cases  https   t co prrdp1ihdz deluxe wallet cases  hybrid dual layer prote  https   t co g4ph4gomgr"
"negative","check out iphone 6 otterbox symmetry black used case apple popsocket bundle popsockets https   t co 0mafjnecgj  https   t co ug1wswdvs1"
"negative","i swear  if i didn t have an  iphone  i d be asleep  hours earlier every night"
"positive","   psa   a  message from  georgewbush    securedabag      inaguration  meme  comical  iphone  art  video  george  https   t co i24fxozroo"
"positive","rt  katzdzynes  love volleyball      check out this girls   volleyball uncommon  iphone clearly  deflector  case features a variety of cute "
"positive","develop your amazing app idea with the help and support of the app development professionals at brainyapps today   https   t co sqdeyhgj9d"
"positive","rt  sugalisciousrea  flowers are like friends   just looking at them makes you feel happy   loveforflowers  randomclicks  iphone  instaclic "
"positive","zombie fortress evolution   brand new out now  download and play for iphone ipad now and play for free    copy quic  https   t co wlrtjvm98q"
"neutral","rt  waysideus     of  roses   iphone  samsung phone case click to get it   https   t co jehxwvpnqr    taylorswift13  taylorswift  swifties "
"positive","new  flutter app    earthrise     earthriseapp  android  iphone https   t co 6afqoombv6"
"positive"," apple can t help   how a molecular biologist trained stay at home moms to recover lost iphone photos     it also m  https   t co a99damxv3y"
"neutral","jeni in the sky with diamonds   4 6 19        streetphotography  kaleidoscope  snapseed  lightroom  iphone  vsco  https   t co jttphxftbh"
"positive","rt  imexxproducts  cat6 patch cord 6 ft https   t co g87uptnwkc  imexx  new  florida  ventas  cables  audios  iphone  gadget  tech  peoplei "
"negative","rt  apppicker  oco app is a hottest free game today https   t co rxruudxdub use simple one touch controls to launch  rush  crash  glide  wa "
"positive","learn the best tips to take vacation photos  https   t co oio0oxcrpz   iphone  vacationphotos  vacationphotography  mrp"
"positive"," sadgirl  iphonecase by turddemon https   t co pyzvweh7i8 cheer up buttercup     cellphonecase  iphone  follow  https   t co d5fp9ob7zo"
