"Response","tweets"
"neutral","selfie stick tripod  ubeesize 51  extendable tripod stand with bluetooth remote for iphone  amp  android phone  heavy d  https   t co gsdadstw7r"
"positive","6 pcs eyeshadow makeup brushes iksmarkets   things and more shop   https   t co db18q66btq tag  follow and share   https   t co hskecaakef"
"negative","how to fix iphone touch screen not working issues https   t co yd3umemoza  iphone  iphoneonly  ios  touchscreen  https   t co uulppxfz3u"
"positive","my best  iphone photo yet of  stpauls from the  tatemodern   just after this the rain hammered down don t let 80  c  https   t co peauygvuv4"
"positive","looks like the fakedroids were all hype    as usual   samsung  android  iphone https   t co s3bxlqz7nr"
"positive"," 2 2  formula from commercial movies or his own first movie he has taken a different route by not diluting the subj  https   t co o8owfrwwar"
"positive","rt  katzdzynes  pink bright yellow girls   softball  otterbox  iphone  case w custom name  amp  jersey number https   t co ngdw61qwnh https   t "
"positive"," eq    got that  dbdrive eq for the diamond system  loud crystal clear          thanks to tom for the help and trip  https   t co ghh86ievuy"
"neutral","college students allegedly scammed apple out of nearly  1m in iphone replacements   the verge  https   t co cx7nryvasd"
"negative","scheme to swap  fakeiphones adds up to  900 000 loss for  apple  prosecutors say https   t co w9jw1rpa3f  iphone  https   t co vu20hdgkki"
"positive","if my  airpods and  iphone had  alexa99  they d literally be perfect "
"positive","rt  ocsutherland  iphones in harlem  traveler  artwork  photograph  iphone  streetart  streetphotography https   t co ajhts2xa78"
"positive","setup apple watch on your new iphone  https   t co uqdurxvt4a  applewatch  applewatchseries4  iwatch  iphone  https   t co etxa67lepj"
"positive","rt  avancohear  the avanco hear   affordable bluetooth hearing aid earbuds   google  earbuds  android  news  hearingloss  iphone  gadgets   "
"positive"," iphonecase  iphone  apple  smartphonecase fashion cute giraffe printed iphone case just  12 98 https   t co s0sai71pz4"
"positive"," cacoteoradio la primera emisora de reggaeton en linea a nivel mundial 24 7    visit https   t co 85q6anhlc8 and hi  https   t co achdmqftid"
"negative","i am a lonely person  that is why i am on  socialmedia most of the time on my  iphone and my  imac "
"neutral","rt  gothamiphone  left from a  screenrepair  bankofamerica  bankofamericatower and had to come take a look  this is the kind of day  nyc is "
"positive","psa for the people that have an  iphone please send me your  applemusic username i need new  music to listen to    appreciate you"
"neutral","college students allegedly scammed  apple out of nearly  1m in  iphone replacements https   t co 5qneqcr4fb https   t co vybjjdmopm"
"positive","glitter marble case for iphone xsmax xs x 8plus 7plus 7 8      0202024981 60cedis pickup delivery available  site15  https   t co yb51bgjcis"
"negative","everyon said to get an  iphone to avoid phone issues  well guess what i ve still got phone issues and now need a new phone   "
"positive","rt  sfnohohon   right to repair  it s your  iphone  why can t you  fix it yourself  https   t co 299w1yfbmu"
"neutral","https   t co vzpdaq63pc is selling  smartphones  accessories  case  screen glass   headset   headphones  car phone  https   t co zy8do9ggbc"
"positive","the most anticipated phones of 2019  find out what new phones are coming out this year  https   t co 3gazcrrcnm  20  https   t co denzbjt8o1"
"positive"," bible verse found with walk the walk daily by  roboticode for  android  iphone  kindle   dailyinspiration https   t co w5fvxjzyjy"
"positive","portfolio management on  iphone   app  appl  ge  free  alienrts  https   t co gvx4977ffi"
"positive","very productive afternoon in the studio   two more paintings started and this piece progressing rather nicely    https   t co jzrbe7pnpp"
"positive","20  off  phonecases today   gifts  art  iphone  samsung  samsunggalaxy  movies  anime  80s  fantasy  videogames  https   t co cwwlrab60y"
"neutral","rt  rajkumar rr  https   t co vbl3yi0mqh how to answer calls automatically by putting your iphone up to your ear    howtoanswercallsautomat "
"neutral","rt  mobilemendz  broken iphone screen  no problem  we can fix that   mobilemendz  iphone  brokenscreen  iphonerepairs https   t co k7f7jayv "
"neutral","rt   techhq  did you know apple has a list of the places you ve been and when you were there  watch this video to find out how to turn this "
"positive","feels good  show with jack  stickers   free  cute  blogger  iphone  ios10  text  imessage  imessagesticker  animals https   t co eg5bzynzrf"
"positive","durability and lifespan  7 tips for extending the life of your smartphone or laptop battery        battery  https   t co 9eml3bxi2t"
"neutral","never go anywhere with out my pen  amp   phone lmao      what s something you can t leave without      pen  hybrid  https   t co o9dq8krao0"
"positive","super fun  osnap  cutpaper  animation from mailemccarthy  nice work     stopmotion  stopmotionanimation  timelapse  https   t co unrh57gler"
"positive","rt  buybackmart  whatsapp business for iphone rollout begins worldwide including india  here is what it does   news18    whatsapp  whatsapp "
"neutral","32gb apple iphone 7 for  289 at gazelle   160 off  no contract  30 day return   apple  iphone  iphone7 https   t co e3g8fob5xz"
"positive"," giveaway   ipad  zen habits   by leo babauta   2 99 to free  on https   t co zjc8dyzymq get the paid app for  free  https   t co n0shakgn8f"
"positive","how to sell used phone with ease and safe https   t co diinub0qru  iphone  secondhand  refurbished  glyde  gazelle  https   t co farlug7fp1"
"positive","rt  techwhenits  tech facts                    smartphone  google  iphone  samsung  technology  apple  android  phone  tech  mobile  xiaomi "
"positive","budgie parrots in ferns  iphone case https   t co dtpe2bgspb via  thecatinblack  technology  gifts https   t co uctkoig6yt"
"positive","best iphone calendar apps for 2019 https   t co by9rodfuqb  iphone  apps  calendar  cybersecurity  infosec"
"positive","rt  gee5ive1113  i m moving forward can t nobody stop me  5        gee5ive  nowornever  gwagon  mercedes  hiphop  photography  iphone  ovo "
"positive","rt  biztechhub  check out eight great reasons why you should check out the iphone 7 instead of apple s latest iphones   apple  appleinsider "
"positive","tech  ios flaw makes it easy to message anyone from a locked iphone    tech  iphone  news  https   t co 9jsmwh7zr1"
"negative","color guard doodle design travel charger power bank https   t co x7karkvxro   charger  iphone charger  apple charge  https   t co lxojjial9v"
"neutral","gymnastics beam design cell phone charging bank https   t co yfrarnksyi   iphone charger  apple charger  android ch  https   t co lqe67oc7ux"
"neutral","price drop   blockwick 2  on sale for  iphone  ipad  7 99  gt  gt   6 99 https   t co mca03v2i9n https   t co 0lau9d7hrv"
"positive","zombie fortress  dino   out now  download and play for iphone ipad now and play for free    copy quick link below   https   t co unoksggvfx"
"neutral","did you that with an  iphone you can now group facetime all your friends at the same time     yeah i know i m not g  https   t co qvqentri1l"
"negative","i want to see something cool  not a meme or a selfie but a pic you ve taken  the sky  flowers  a pet etc  i don t c  https   t co epvwx3eauu"
"negative","today  the fastest growing free app in the us    is  thief robbery  sneak simulator   it debut at the number 18 spo  https   t co ipqp2ukqxz"
"neutral","are you a  mom   blogger  iphone  ios10  texting  imessage  imessageapp  imessagesticker  text https   t co xtuztv4whj"
"positive","black and white  japan  tokyo  musashino  kichijoji  inokashirapark  nikon  d850  d3s  d5600  iphone  landscape  https   t co z4xqf9elyc"
"neutral","rt https   t co kitnb9eqmt rt https   t co xyiwkp8u4z hp z3 mini g3 workstation  technocratng  technocratnigeria  https   t co pkfqwzk8mc"
"positive","rt  peterle1311  rt  ramaraobobby  how to restore iphone from icloud backup   ios  iphone  icloud  tips  https   t co rwhghzobnb"
"positive"," konekt    iphone app   family  relatives  friends  create your original human relations  https   t co njarmzruco  iphone  ipad"
"positive","rt https   t co casgx3qw9y rt  daygadgetlife  do you know what it s like to have almost everything at the palm of y  https   t co 4dwrkvnc81"
"neutral"," perfectmoment caught on  iphone  runsra cim  sactownrun 2019  dj  discjockey  djsupe  run https   t co kgaxrlne5d"
"positive","5 reasons why the iphone is a poor choice for portable audio  now up at https   t co puwa6rz6pt   darkoaudio  https   t co phg2qasvxe"
"positive","hey guys  sports  amp  fitness in https   t co rpgttodmsn  shopping  price  money  coupon  tv  car  video  aws  prime  https   t co ulzbdrpgco"
"negative","at the  iphone store with my  samsung out and proud  never felt like a bigger rebel"
"negative","imagic trick on the  appstore https   t co vujmysynwv  magic for the  iphone   ipad and  applewatch"
"positive","tag someone that loves it  welcome to https   t co clv0rotsyy   phone  android  iphone  phone https   t co pzuyfahq9q"
"negative","killer mobile  filmmaking apps for indie filmmakers https   t co 69ayghuafe  iphone  screenwriting  filmproduction"
"neutral","unboxing ipad air  2019   la nostra photogallery https   t co noaachrg5h  apple  ios  iphone"
"positive","rt  chinmaythosar  just a note to everyone using  iphone  maps in india to go to privacy settings  gt  location and enable traffic data for pr "
"positive","rt if you like the  celtic news now app  get it free on  iphone  amp   ipad https   t co 8hbrcjz832"
"positive","great music app for  iphone  https   t co a7nsuenbe9"
"positive"," vladsavov neither software nor the hardware alone is enough  both are equally important with software being a tad  https   t co vxcqzuioee"
"positive","check out new apple iphone 8   iphone 7 leather case   taupe   mqh62zm a   genuine apple  apple  iphone  iphone8  https   t co ksdiizvjup"
"positive"," iphone xs specs vs  xs max  xr  x  what is the same and different   https   t co aoquvtkia7  technology"
"positive","you can t watch hd movies on your broken  iphone dispaly  we fix it in 30mins   amp  enjoy  hdmovies  offer starts rs 4  https   t co m79lacnckg"
"positive","rt  device world1  usams bob series leather case for iphone 8plus 7plus 6plus      0202024981 55 cedis pickup delivery available  site15  i "
"negative","lol just giving you guys the warning       android  iphone  lol https   t co psa7dlukc4"
"positive","rt  mmandmp pro  photo of me eating fish and chips with out a tripod for my phone  fish and chips at wetherspoons pub leicester  high cross "
"negative","2 college students accused of cheating apple out of  900 000 using counterfeit iphones   thehill  apple  iphone  https   t co dri1lxvkna"
"positive","if someone could point me in the right direction of some useful info on how to up my camera game on my  apple iphon  https   t co qo5nei3gdu"
"positive","sim unlock  sprint  boost  att  tmobile iphone x 8 7 6  neterair  iphonex  iphone  swiftunlock  iphonex  unlockcode  https   t co x8gg7sz98w"
"negative","  newly discovered developer tool        menubar for wip   log your todos with just a keyboard shortcut  go check i  https   t co jq1rbarld2"
"positive"," get your majestic  birds  stickers   blogger  iphone  ios10  texting  imessage  imessageapp  imessagesticker  text https   t co gf5otjwh2c "
"negative"," apple  applemusic apple reduces price on  iphonexr  iphone  applemusic in  india drastically   has  apple started to  panic"
"neutral","rt  android result  display comparison between galaxy s10 plus and iphone xs max  samsung  galaxys10plus  iphone  iphonexsmax https   t co  "
"positive","rt  digidna  is your  ios data safe  if it s not  you can fix this by backing up your  iphone or  ipad with  imazing     enter this awesome "
"positive","applemusic  apple  news  iphone  ipad  ios9 3  beta1 apple may be planning to break up itunes with new music and po  https   t co n9wrpv7rdn"
"negative","guess what am i   riddles  trivia quiz   wordguessing for  iphone  amp   ipad https   t co 3h7kjwx3yj https   t co bxgml87cid"
"negative","leaked 2019 iphone 11 chassis shows triple  apple  latestnews  apple  iphone  iphone11  iphonerumors  uncategorized https   t co 2gfztwx3if"
"neutral","rt  appleinsider  a photograph of a part claimed to be the internal chassis of a 2019  iphone has been posted on the chinese social media s "
"positive","find the pair  memory matching cards  brain trainer game for  iphone  amp   ipad by  itunes  appstore linkedin talent s  https   t co flpuhbvkwl"
"positive","rt  moviecavedave  batman  wallpaper  done   tap  hold  n save   batman  thedarkknight  wallpaper  iphone  otherphones https   t co udyqmut "
"positive","https   t co q5xejhrkb7 stickling   sticker  maker  studio for the personal touch of your romantic chats  download  https   t co kkqtlwwjm7"
"neutral","balenciaga phone case iphone 6 6s plus 7 8 plus x xr xs max  realcasepeace https   t co op0arevkim buy now   https   t co locritlftd"
"positive","rt  josecfigueira  check out my gig on fiverr  create unique phone cases  link  https   t co am6lcow3dk   https   t co 02wjkchzix"
"positive","rt  c180k  another stunning morning at station pier   portmelbourne  spiritoftasmania  nofilter  iphone https   t co bxfsqjvgcn"
"negative"," iphone app  developer  looking for a  job or  hiring  look at  jobely https   t co ufmc0rekti  iphonedev"
"positive","rt  gabryc93  how to have an aesthetic phone   inspiration  backgrounds  fonts  amp  contacts https   t co cedkfaaj6e  pinkynature   background "
"negative","i  it when my  apple  iphone  in  selfdestruct mode   freezes every 3 5min and requires a  hard  restart about 3 4  https   t co doweu1tpus"
"neutral","broke your  iphone while watching  ipl2019 match  looking for best  iphone service center in  mumbai  call 022 4345  https   t co nshcn6kpec"
"positive","how to learn swift programming   ultimate beginners  guide  swift  swiftlang  swiftprogramminglanguage  ios  iosdev  https   t co j8iuqqubw6"
"positive","rt  wharrio50      perhaps  address to  apple the brand blackholeconcepts   hereby  accepts your 2010 entry    there are many black hole co "
"positive","what  apps are you using today  enjoy your day on your  iphone and  android devices and let us know what apps you love   iuta  mobile"
"positive","time to travel   join airport services and benefit from 10  off   travel with confidence     https   t co sxyey0xbnr"
"positive"," apple needs a service like google fi  that would be so delightful   apple  iphone"
"positive","i ve just received an achievement  recognized architect https   t co bz3p3jc0hy  iphone  iphonegames  gameinsight"
"neutral"," aashish kumar for the follow  cloudunlock check out  apple  icloud  iphone  aapl for  unlock  code https   t co sfe120jkjh"
"positive","hey guys  video games in https   t co rpgttodmsn  shopping  price  money  car  coupon  tv  video  aws  prime  https   t co oub5vncdva"
"positive","officially lost faith in humanity  left  iphone cord at office  phone and battery 0  borrow cord from nice stranger  https   t co njl7id5yjq"
"positive","rt  love allah 01  this is the  book about which there is no doubt   iphone https   t co tq7xawdvdd  android https   t co wf6ewebbyd  rt  u "
"positive","rt  techinrl  mynt wireless charging pad review  https   t co crcbkbhuku   mynt  wireless  qi  iphone  android  iphonexr  review  airpods2"
"neutral","for iphone users  the good news is you don t have to worry about your phone getting viruses  however  if you suspec  https   t co pl2gks7jif"
"positive","apple s shocking new  iphone design makes sense https   t co run51ebuec"
"positive","is there any greater feeling of relief   make sure to use a quality phone case and screen protector to reduce the r  https   t co q2snjclddw"
"neutral","rt  humbleattitude1  butterflies pattern design  link   https   t co 1ylrg9ih7i store link is in my profile  butterfly  swallowtail  monarc "
"positive"," new in latest release  skill calculation support for   nfaa indoor target face  104 6 top right on this screenshot  https   t co vjqio0rnl0"
"positive"," bible verse found with prayers  amp  blessings daily by  roboticode for  android  iphone  kindle   dailyinspiration https   t co j0ffganibe"
"neutral","this should ve been the official presentation of the iphone x  tim cook  apple      oviyaasweetz semma ya irukaa la  https   t co d7ombwkbgz"
"positive","hey guys  kindle e reader https   t co rpgttodmsn  shopping  price  car  money  coupon  tv  video  aws  prime  https   t co mvausmophq"
"positive"," brand new release assassin vs mummies match 3  mac   version visit mac app store now to download for  free  click   https   t co rzring9mmh"
"neutral"," whatsapp s  business app comes to the  iphone https   t co tiefzk9wlk   by  sarahintampa via  techcrunch"
"neutral","rt  1nsane dev  my  applecollection is getting larger   prototype  iphone n841ap on nonui 16a and xr on  ios 12 1  appleinternal  switxhboa "
"positive","rt  itsallwidgets  new  flutter app    earthrise     earthriseapp  android  iphone https   t co 6afqoombv6"
"positive","the  iphone won t autocomplete  masturbate   even if you type  masturbat   however  if you type  masturbate   it ac  https   t co 6rqc36mhiy"
"negative"," 5g should be debuting this year  but the  iphone may not debut its first compatible phone until after 2020  get th  https   t co mftprjqsbc"
"positive","rt  hos houseos   before buying a  smarthome devices make sure they are compatible   well  that s history  now  with hos smart home you are "
"neutral","rt  digitaltrends  how to factory reset an  iphone  from xs on down https   t co 0smrspnohu"
"positive","rt  abrahamara  good morning       cycling  ride  jakarta  roadbike  iphone  iphonography  iphotography  instagram  instagood  instaphoto   "
"positive"," hey siri  ignore the lock screen    gt it s really easy to message anyone from a locked  iphone even if it s not your  https   t co azfsuxcohr"
"positive","rt  bitcommander  keep your secret photos  amp  videos hidden on the iphoen with photo safe   secret  app  photo  video  iphone  nightrts  http "
"positive","rt  mikewellsauthor  how to download  amp  read  free ebooks on your  iphone   android phone   windowsphone  blackberry   it s simple  https    "
"negative","tweak   locallapstore  1 4 2     local appstore pay hack  condition     95  work    no work all apps games  repo     https   t co dtkwll4mrp"
"positive","top best ios apps for kids https   t co ersxh42vhg  ios  ipad  iphone  appstore  apps  games  education  https   t co hlet5bzmrp"
"neutral","redefine your smartphone experience with the latest  samsung galaxy s10   call  08140000114 https   t co reb1mdampw  https   t co 5pyad195ug"
"negative","rt  heapooh  apple iphone xr price slashes in india   starts at inr 53 900 https   t co opmci8khmo  apple  iphone  iphonexr  iphonex  iphon "
"positive","universal quick charger for smart phones and tablets  8 99 amazon 5 stars  gt  gt  gt  https   t co 55edqkcold  phone  iphone  samsung"
"positive","pink bright yellow girls   softball  otterbox  iphone  case w custom name  amp  jersey number https   t co ngdw61qwnh https   t co qvoow6hiv1"
"negative","just saw a kid refuse an iphone after his mother handed it over to pacify his boredom   winning  digitalnative  https   t co pfh1zpx3gt"
"negative","circle dragger   beware black dots and  obstacles for  iphone  amp   ipad  itunes  appstore  funnyapps  https   t co ut34nczlkh"
"positive","rt  bnjmnwood  well  that was a quick 30 days   applenews  applenewsplus  iphone  ipad  ios122 https   t co 5lbwtelknf"
"positive","original wireless headphones for ios and android waterproof  high quality   https   t co qhovzceaos   android  ios  https   t co urdtyniycb"
"positive","i think that the  iphone will surpass 2 billion phones soon"
"positive","today  the fastest growing paid app in india    is  my town   school   it debut at the number 24 spot   more inform  https   t co piqk0zrwhl"
"neutral","daggerhood review for ps4  ps vita  xbox one  switch  platform   ps4  also on   ps vita  switch  xbox one  publishe  https   t co w5ggqkruxp"
"positive","those screens though    iphonexs and  applewatchseries4    apple  iphone  colorpopeffects  applewatch  technology  https   t co cf2jfafoda"
"positive"," setup  digging in dropbox old ios 6 setup  enjoy jaku skeumophorism via  r iosthemes https   t co 6mzujx8flc  ios  https   t co gc6nq9ldqv"
"positive","forgot your  iphone  password   here s how to restore access when you re locked out     cnet   https   t co mn2lnwy34j"
"positive"," apple is censoring a legit independent  iphone data recovery shop on their forum  i can t understand why   she s n  https   t co dtsj7tains"
"positive","rt  cellcrazy  sell your phone for cash    get your free valuation here   https   t co 22hvhrcm2o   iphone  samsung  android  buymyphone  s "
"positive","best  business card scanner apps for  iphone and  ipad in 2019 https   t co sksfn4oghz"
"neutral"," didyouknow the first video camera recorder ever made was the size of a piano     what movie would you play on this  https   t co rj4nwdgina"
"negative","rt  nameecase   make money not friend case        i5 i5s ise i6 i6s i6  i6s  i7 i8 ix      line  https   t co 8uriuh58nc      for more  ig "
"neutral","i ditched my  iphone and it changed my life https   t co x4dlo5nib6  tweet4mee"
"positive"," before buying a  smarthome devices make sure they are compatible   well  that s history  now  with hos smart home  https   t co muacckzpwq"
"positive","3 symptoms are helps to know your  iphone is  water damaged or not  https   t co tmalz2eatw"
"positive","today  the fastest growing free app in india    is  run race 3d   it debut at the number 65 spot   more information  https   t co y6kqcio9vv"
"negative","country and capital quiz   ios source code   https   t co nptawcvt8h via  codesterhq    triviaquiz  3wordguessing  https   t co nvgieeznba"
"positive","hi i sell phone accessories  business page on instagram lucyaccessiories6 here is a few for my iphone users  kindly  https   t co vorlzmzc8v"
"positive","my  iphone is for  siri   swift  amp   voiceover  learning  seeingai is merely optional  my  android with  google  https   t co 2ur5haiyne"
"positive","my sunday special just for you  the three eyed raven phone wallpaper   grab it free at https   t co 4mlso8pcsh  ple  https   t co mks8c6hwsb"
"neutral","8 ball pool  315 4 double pots in a row  8ballpool  8ball  gamestagram  iphone  blog  gaming  miniclip  gaminglife  https   t co ljstk76jem"
"negative","teen dreamcatcher animated  stickers  slay   blogger  iphone  ios10  text  imessage  imessagesticker  chat https   t co u01pxostkx"
"positive","wireless phone charger   a new way to charge your phone    fast charging and    original   50  off for few days   g  https   t co tng2wqi0pv"
"positive","more coming soon        black butterfly collection 18   model   lay lay1995  designer  jas thomas photography  jas  https   t co sxoxofuv1j"
"positive","let your mind wonder then go back inside and beat that boss you can do it   gamers  gaming  gamergirl  game  https   t co adafuvcafi"
"negative","one of the worst features of  iphone is the automatic wifi bluetooth which has to be switched off from settings  no  https   t co hnapeir1v5"
"neutral"," charger  car  mobile  tablet  quickcharge  speedcharge  recharge  carcharger  highspeed  today  drive  tablet  https   t co rvbqxz06oa"
"positive","rt  thinktolead   i m convinced that the only thing that kept me going was that i loved what i did  you ve got to find what you love   stev "
"positive","isn t it cool     laptops  ongadgetshop  hack  screen  iphone https   t co jtx9zc73zy"
"positive","wizard vs zombie   match 3   free     iphone  ipad version available now to play for   free   in all app stores itu  https   t co ge8xxa9jo3"
"positive","apple s china problem solved   name the next iphone  11  the iphone xi after china s leader xi jinping and china wi  https   t co ad54plbarm"
"negative","according to this  engadget piece  amazon s earbuds are a shot at google  not apple  here s why   https   t co m0cxauwftb"
"neutral","friends forever   shotoniphone  shotoniphonexsmax  shotoniphone6s  apple  iphone   pic  picoftheday  photography  https   t co gubclcd56x"
"neutral","nowplaying   romo   the last slice of pizza  https   t co 6xyfg30t2w   iphone app https   t co csmu9zw1an   peripouwebradio"
"positive","rt  datarecoverysg  hard disk data recovery singapore is the perfect place for you to find reliable data recovery service for hard disk  th "
"positive","tech armor  iphone xs max screen protection  amp  accessories click and buy here  https   t co a1dkdo4gpp    iphone scr  https   t co xbrfm0tfic"
"positive","tweak   gravity    funny gravity effect to home screen icons    condition     100  work  repo     https   t co lzeywfpeav"
"positive","free iphone mockups made by  extravaganso   mockup  iphone  iphonemockup https   t co ab2ipubbq0"
"positive","about two years ago or something  in a hotel downtown houston  this was just a cool place to take a photo  apple  https   t co 8sdv7tmwvm"
"positive","how to reset your airpods  https   t co adzofj0xth  airpods  airpods2  airpods2  airpods2  airpods  iphone  apple  technology"
"neutral","rt  ar72014  all  iphone  wallpapers pack by  ar72014  part  3   15  https   t co yhpxozljao  16  https   t co yyrrftsy8y  17  https   t co "
"positive","quan yin says   this is a selfie of you and me together as one    art  painting  true  universal  precious  https   t co d5cxzk9szo"
