"Response","tweets"
"positive","my iphone says last week my screen time was down 5  for an average of 1 hour  39 minutes  the good news  my real li  https   t co u2xek1p5gg"
"positive","rt  eea38695b7104c1   giannasimone1  my fx  art download  werbleapp on  iphone news  apple  art cathyhunt  ipadinsightblog  ipad storytime "
"positive","rt  jerryw9fs   bible verse found with words of jesus each day by  roboticode for  android  iphone  kindle   dailyinspiration https   t co  "
"positive","hey guys  kindle e reader https   t co rpgttodmsn  shopping  price  car  money  coupon  tv  video  aws  prime  https   t co edb1ggskkl"
"positive","sony introduces new playstation store refund system  new system affects preorders and  with caveats  released games  https   t co 9pxxybnbqj"
"positive","good morning london    earth  wish  trees  life  love  happy  wonderful places  iphone  photogram  photographers  https   t co 7h2tqexdzu"
"neutral","47 users just unfollowed me  via  findunfollower https   t co 5dporfutml   iphone  app"
"neutral","64gb apple iphone xs max for  929 at gazelle   170 off  no contract  30 day return   apple  iphone  iphonexsmax https   t co lfnqkjszci"
"positive","rt  sutharphp  enough is enough    disappointed after straight 4rd week s  redminote7pro flash sale   i will never ever buy redmi or xiomi "
"neutral","speed up chrome with these simple tips  android  iphone  phone  phones  mobile  apple  leomessi  katyperry  https   t co qjpv4wn0ou"
"negative","back to my trusty  android  that  iphone was driving me insane  what a piece of shit  "
"negative","i think to truly give up your habit  porn is to give yourself time limt 2 hours on  iphone or  android then find so  https   t co qlkfsx7vhg"
"positive","where can i buy cute  phone cases for my  iphone  https   t co wjmucxdght"
"positive"," apple rumoured to still be working on an  iphone  se2    tech  innovation  fragmentation mobile  https   t co v3qj9fsnl4"
"negative","price drop   death worm  on sale for  iphone  ipad  1 99  gt  gt   0 99 https   t co qa20uwgv23 https   t co aqjhzgaaw9"
"negative"," iphone rumors now claim two oled models with triple camera arrays for 2019  theverge https   t co naeoj9uont  apple https   t co bxqqujmorl"
"positive","women s formal trousers   van heusen womens straight pants shop   https   t co ff1yca3kki  allen solly womens strai  https   t co bu3kjwzczg"
"positive","maya collection   abstract  wallpaper  original  hdwallpaper for  phone  new series is coming soon  https   t co hkxnkhcyjk"
"positive"," win an hp sprocket plus from  compatink1 to print your mobile snaps on the go       enter here    https   t co hcr4x1h64c"
"positive","interesting leaks on the new  iphone from  phonearena  i am guessing they will be launching this as the most premiu  https   t co 9m3aqk5fuc"
"positive","safely browse the web on the  iphone  completely anonymous  hide your bookmarks and browser history with a passcode  https   t co klq5f1xgrb"
"negative","rt  kevinfeeds   applesupport  xs max on verizon dropping calls constantly  on third phone  even though thousands of others complain about "
"positive","  iphone 8 plus   128gb   5   with box shop receipt  12 month warranty  amp all networks        imfixed bolton  bolton  https   t co qfjbu3rs8d"
"positive","protect your iphone data and make find your iphone more useful before your  iphone slips out of your hands    https   t co rx7dx5hmq2"
"neutral"," 3in1 dock for  iphone  applewatch  airpods   smartalecases https   t co 5xj3vg9xxw https   t co juftymkkwd"
"negative","rt  udsteep  dear  iphone users have you ever suffered from this issue   iphone6  iphone6s  iphone7  iphone7plus  iphonese https   t co tae "
"neutral","i use this app all the time to scan in documents  manuals  recipes etc  it turns it into a  pdf that you can email  https   t co csjwicdnkz"
"positive","how many people are  applemusic    iphone   mac  lover  if yes then this for you    6  cashback itunes purchase     https   t co oo5x7ngciu"
"positive"," ramen  yummy  tampa  downtowntampa  armatureworks  foodie  iphone  iphonephotography  family  lunch  photooftheday  https   t co pf6rrraial"
"positive","rt  bluelynxonline  apple airpods with wireless charging case  more magical than ever  https   t co pypwojnyk4  apple  airpods  iphone  ins "
"positive","hands on with twttr  twitter s new prototype app  with more detail on the app s color coded replies  hidden engagem  https   t co jjbltgfk7a"
"positive","vault doodle design cell phone power bank https   t co c8mp95gjnm via  fancy   iphone charger  apple charger  https   t co ivyauxm8lu"
"neutral"," kim kardashian   hollywood app apes review  https   t co wrahm7xs9i  apple  ios  ipad  iphone  kardashian"
"positive","rt  lineofdutyuk  who would like to  win an  ipadpro  1  like our page 2  retweet this post 3  type  done  in the comments      giveaway  c "
"positive","terminus iphone skin by art falaxy  love the skin your tech is in    artfalaxy  art  phones  iphone  ipad  skins  https   t co uqsx7xs17w"
"positive","day 18 urban nature spring 2019     urbannature  nature  spring  artist  art  photography  naturephotography  https   t co zjco7rdhiq"
"positive","top selling  prescription  drugs 1   humira  2   eylea  3   revlimid  4   rituxan  5   enbrel     medsminders  meds  https   t co u2o20gkixj"
"negative","mermaid scale plastic case for iphone  computers  laptops  hack  screen  iphone https   t co zukj6pkog8"
"neutral","nowplaying   void pedal   via harbor  https   t co 6xyfg2isbo   iphone app https   t co csmu9adcyx   peripouwebradio"
"negative","price drop   solunar best hunting time  on sale for  iphone  ipad  2 99  gt  gt   1 99 https   t co cbypg873os https   t co 0ax2rksqi7"
"positive"," iphone  app  5 000 love messages  love is born with the pleasure of looking at each other  it is fed with the necessity of seeing each othe"
"neutral","iphone app  timetable of life  know the time given to you https   t co rrtr30lyco  diary  health  horoscope  https   t co fdgsow9kjz"
"negative","prior to my  blindness  i developed for all operating systems  except  ios  now that i m  blind  why not learn  https   t co vyvlivrql6"
"neutral"," qiwireless  wirelesscharger for  iphone  applewatch dock  amp   airpods   smartalecases https   t co ibglqcz2ya https   t co t9auubsuj6"
"positive"," apple  tim cook thanks for shadow banning people who love your products so much  they don t want to throw them awa  https   t co oemob2zmwu"
"positive"," giveaway   ios  photox pro top live wallpapers   1 99 to free  on https   t co 86vfcske13 get the paid app for  https   t co ytt9rkzyhu"
"neutral","if it s happening  then i am waiting for it     iphone  iphonexe a replacement for all the folks using apple 4 inch  https   t co 9gkxy7wep7"
"neutral","rt  ianmartinson236  the  apple before  iphone  lelamarkham  sw6owl  kompatik  btilert  man14 14  artistunknown28  rpwilli23  lisaksalerno "
"positive","just got a new  applewatch  it picks up the alerts from my  iphone for my digital thermometer in my smoker  i have  https   t co 5p7fezgsao"
"positive"," josemarmmoreira check whatsapp   iphone is unlocked  100  clean fast service  thx for business  gsmicloudunlocker  https   t co mepgf6mopk"
"negative","rt  amanda siegrist  hungry  devour the sweetest obsession and feed your appetite  drowning in you is included in this wonderful set   plus "
"positive","rt  dasv1  drawmanga   entertainment  http   t co nswj29t9yq  iphone  app  free"
"positive","rt  crazygadgethere  surprise discount for apple homepod  apple  applehomepod https   t co f8emtqfnmy  apple  homepod  discountforhomepod   "
"positive","new  photo editor pro for free   iphone  ipad  freeapp  ios https   t co zv5ch6oi8s https   t co 7mwlvufcjw"
"positive","check hos smart home new  apps for live  automation  control  sonos   ifttt   diy  apple  homekit  digitalstrom  https   t co uenr5wpien"
"positive","rt  bsindia  there s finally some good news if you are looking to buy one of the latest iphones  listen to this  podcast to find out much t "
"negative","now when every app that i use has  darkmode now  after sometime it becomes so depressing so i switch to regular whi  https   t co ad2zqmn4pq"
"positive","hey guys  videos in https   t co rpgttodmsn  shopping  price  money  coupon  tv  video  aws  prime  primevideo  https   t co agu4sbrsba"
"positive","2 in 1  wirelesscharger for  iphone and  iwatch    mobile accessories  gift   power your  brand with our tech  https   t co 39t6nubsrk"
"neutral","price drop   ticket to earth  on sale for  iphone  ipad  4 99  gt  gt   3 99 https   t co 2gkq0i3vma https   t co yde7jsbxio"
"negative","problems with your imac  macbook  ipad or iphone  then pop it down to our workshop in roundtree way norwich  apple  https   t co 3wvjuqfogg"
"positive","rt  firstserveapps  do not miss a day of  golf history via the  thisdayingolf app   iphone  https   t co py2xalnrd3"
"positive"," spring savings sale   100 off the apple iphone 8 plus  visit https   t co khyyguf7wm  apple  springsale  iphone https   t co uoxqkhedna"
"positive","rt  wfbrother  cool colours  triple camera  copied from an android phone  huh    iphone11  iphone  tech https   t co idt4qwaeot"
"negative","is it me or am i the only one that always accidentally trigger the screenshot function on the  iphone x "
"positive","apple iphone 7 plus 32gb   the best budget big screen apple iphone          iphone7plus  appleiphone7plus  apple  https   t co qnanpljjtv"
"negative","check my video about one plus 7 leaks here https   t co n7thvqvc1j  oneplus  iphone  photography  samsung  india  https   t co tzip7wv1ma"
"neutral","64gb apple iphone x for  699 at gazelle  no contract  30 day return   apple  iphone  iphonex https   t co aqdn3nbqfu"
"positive","final coat on    poly  money  namaste  isuzupup  model  poping  pandaexpress  hi  army  honda  nike  alive  love  u  https   t co rayvcuroqf"
"positive"," iphone  android  carmounts  available  monday  30  mattselectronicrepairsllc  phoneaccessories   at matt s electro  https   t co 1bo4mxqn83"
"positive","record outstanding  videos using an  iphone  must know      https   t co ua480bgohd"
"positive","a  mom  get hipster mom  animated  stickers   app  blogger  iphone  ios10  text  imessage  imessagesticker  chat https   t co gzjb3bw8n4"
"neutral","rt  dailyfinds4u  otterbox case apple iphone cases   usa flag      https   t co 0jezyn0ly4 via  zazzle   usa  otterbox  apple  iphone  zazz "
"positive","two way wireless charging could be a game changer for  aapl  iphone sales  https   t co fggka4dotj"
"positive","need to replace microsoft band for iphone   stepwise lets you keep track of your daily steps and is available for f  https   t co nhmaesl0pd"
"positive","best bargain on iphone 7 plus    send a dm or click on link in bio for this and many more hot deals     sales366  https   t co qmxfaf24fs"
"positive","hey guys  televisions  amp  video https   t co rpgttodmsn  shopping  price  money  coupon  tv  car  video  aws  prime  https   t co jo25xdwyjp"
"positive","as a  blind person  i require silence to learn something  such as code swift  using voiceover  though headphones is  https   t co oh3mdkqgmk"
"neutral","iphone 7  one thing you didn t know   apple  iphone7  iphone  https   t co hd4rdewth2"
"positive","best unit  amp  currency converter for  iphone   free  cad  ron  gbp  sek  hkd  mxn  krw  btc  converter  aed  app  zar  https   t co tksgkdompd"
"positive","get a  iphone from just  59 99  ask staff about  tradeinatgame to save money    terms and stock levels apply https   t co 7o9nqyrdem"
"positive","get 10  off all iphone 7 and 7 plus  at https   t co kehonzpvbj    discount only valid until 7th april so act fast   https   t co mfbdsgjbg5"
"negative","so i update my  iphone and use my  amazon video app  amazonhelp    so now amazon demands i pay prime video through  https   t co mrggwfxxf0"
"positive","f5 networks  which makes cloud and security application services  to acquire rival nginx  which powers some of the  https   t co pqrw5rnrnp"
"neutral","news slideshows  04 07 2019    vlrphone  iphone  https   t co iduqmokshr"
"positive","what s the best browser for  iphone  we compare 7 apps so you don t have to  https   t co vhbnwqcjsn"
"positive","mouse pad https   t co kgxjs5cdhd  imexx  new  florida  ventas  cables  audios  iphone  gadget  tech  https   t co 5wdh5hvgoz"
"neutral","chicken satay          follow   manavpiplani        picoftheday  likesforlikes  sodelhi  nom  indianfood  platter  https   t co ir7kmxvtxq"
"positive","how would you call this  iphone concept  https   t co dfr8tfrxq0"
"positive","hey guys  kindle e reader https   t co rpgttodmsn  shopping  price  car  money  coupon  tv  video  aws  prime  https   t co g9ujffcc0y"
"positive"," cacoteoradio la primera emisora de reggaeton en linea a nivel mundial 24 7    visit https   t co 85q6anhlc8 and hi  https   t co jg4nqav1rd"
"neutral","meet radha from mythology     more info  https   t co lofonfgbia   mixedreality  6dai  apple  madewithunity  https   t co jyptmxpkhi"
"positive","whatsapp business app is now available for  iphone in brazil  germany  indonesia  india  mexico  the u k  and the u  https   t co dn7dlxvg7e"
"negative","my gembine hidden game mode got 10k points at  crimsonland for mobile version  ios  iphone  ipad  https   t co iyjhx6jkgl"
"neutral"," nowplaying juliette by shinee on  audiogate  iphone https   t co 6qvu1wqjsp"
"positive","rt  nupetc1  i learned today that if you hold down l on you  iphone you get the    litecoin symbol     this is awesome  litecoinfam https   "
"neutral","whatsapp s business app comes to the iphone   techcrunch https   t co flvzjgikgm via  googlenews  whatsapp  tech  https   t co godjnrhscj"
"neutral"," biffbutler especially when your  apple  iphone does not recognize your face and now have to key in your password      "
"positive","great new quadratic calc app https   t co l6xgk2ed4y  math  techtalk  iphone  ipad  mathchat  teachers  tech  https   t co b0djanefy0"
"neutral","rt  kdrmark  is your phone listening to you  an experiment https   t co qyeybyuq4m  phone  apps  ads  advertising  facebook  iphone https   "
"negative","future iphone  apple watch sensors could detect low blood sugar based on body odor alone   applewatch  innovation  https   t co n6cn29gw8t"
"positive","rt  iphonephotogra6  look up to see the magic  disneylandparis  disneylandparis  disneyland  paris  mainstreetusa  tinkerbell  stainedglass "
"positive"," brand new release  little monster games   mac version   visit mac app store now to download for  free  click copy  https   t co fvpnopghpx"
"positive","in 2007  apple inc  ceo steve jobs unveiled a revolutionary product that changed the way smart phones looked in wor  https   t co c0hvbrgolx"
"positive","  apple finally killed off its promised  wireless  charger  which was meant to simultaneously power up an  iphone   https   t co adfhadl15x"
"neutral"," iphonecase  iphone  apple  smartphonecase anime of tarzan iphone case just  12 98 https   t co 7c06ezxyub"
"positive","have fun while learning to add game https   t co oc9g5a9nkv  math  techtalk  iphone  mathchat  teachers  tech  algebra  edtech  edchat"
"neutral","updated pythagorean calc  app https   t co jizwqhioai  math  techtalk  iphone  ipad  mathchat  teachers  tech  https   t co k0qlj1fcfr"
"positive","good  morning     supercalifragilisticexpialodocious  papi  tat  white  lion  me  armpits  abs  chest  iphone  https   t co uhxwhyh80c"
"positive","sunrise   views that make the pain to wake up at 4 30am more bearable      sunrise  windmills  windmills  water  https   t co zysfbh3dmm"
"positive","rt  humbleattitude1  pet salon and spa pattern design available in my teepublic store  https   t co e0ynpm3hid  teepublic  pattern  design "
"positive","some epic shots of flowers at peradeniya garden                                          photography  photographer  https   t co o3wzjrojgz"
"positive","rt  realgmurder   tim cook  apple  applemusic  i did this awhile back every body loved it hope you guys do as well maybe ya approve wink wi "
"negative","yesterday was fred s last day at gravity  we will miss him but are excited to hear what he does next    join this i  https   t co gyfwlfzh4p"
"positive","can t remember if your apple device is still under warranty  how to check the warranty status   https   t co elollnufib"
"positive","y all better start eating clean    i m out here lookin real youthful lmbo         periodt  gocrazy  tgif  fitness  https   t co 4r87yulzl3"
"neutral"," vendbienjon  notabubble  gerberkawasaki  daesr1  dizzle8989  solon594bce  deafdaytrader  7wtc  jonfortt  https   t co pj7x7rraln"
"neutral","price drop   funnel  on sale for  iphone  ipad  2 99  gt  gt   0 99 https   t co ve3syywhx8 https   t co xpd05qupej"
"positive","rt  stinigeriaplc  can you believe it   stifacts  sti  facts  iphone  harrypotter  books  rubik  cube  product  history"
"neutral","  take with a  phone  iphoneonly  iphone  iphonex https   t co xs41o7j3a7"
"positive","wizard vs zombie   match 3   free     iphone  ipad version available now to play for   free   in all app stores itu  https   t co gol1fhwtu0"
"positive","rt  semiratj   iphone giveaway  i am giving a iphone xs max for fun   simply retweet and follow to enter the  giveaway "
"positive","rt  devansh92139903  visit my website  https   t co 3xyxnmil1d like share and subscribe for latest updates   website  share  business  news "
"positive","good morning guys   me  myself  selfie  morning  goodmorning  man  guy  boy  teen  instaboy  instaguy  instaman  https   t co xbqa2q8bu7"
"positive","he is easily elated         snapshot  iphone  tripod  robot  wallpaper  instagood  likeforlikes     nagoya shi  aic  https   t co xai2bosyaf"
"positive"," codeunlock neter air 2 0 pro unlock sim    unlocks most major carriers instantly https   t co gt5cgoin0s  https   t co cg7ljb35p9"
"positive","rt  oispice  how to  unlock  iphone without passcode https   t co 2mlk8jxhsw via  latest  technology  news updates  latestnews  technews    "
"neutral","rt  ar72014   rt  iphone  iphonex  wallpaper    all iphone  wallpapers pack by  ar72014  part  1   1  https   t co 6usmfqgjst 2  https   t  "
"negative"," yjaswrites  apple  applestores  applesupport  appleuk    appleuk  noooooo way     surely that s not right  wow   i  https   t co 3zhs4j44tu"
"neutral"," wallpapers  iphone  geometric  lockscreen  apple  abstract  devices  homescreen  geometric  wallpapers for   https   t co b8vdi1zpwz"
"neutral","netflix elimina il supporto ad airplay https   t co jw6dypcyvm  pcexpander  cybernews  apple  newsapple  iphone  https   t co nhxli7ozae"
"neutral","have you used this feature on your apple watch   apple  iphone  tech  ios  siri  airpods https   t co dvoshij6ol"
"neutral","goodbye horses   venusinfers  musiclover  photography  iphone  magestic  signal  guiltypleasures  elpaso  texas  us  https   t co odjdk36poe"
"positive","   nowplaying aqua   like a robot from  tobiasvariano s  iphone by briptu rn ldd   music  polisi  cop  police  lagu"
"positive","it s april 07  2019 at 08 01am  good morning people   checkout our free apps at https   t co 2bnmswwwlg  ios10  https   t co qysm3qinlt"
"neutral","64gb apple iphone 8 plus for  529 at gazelle   170 off  no contract  30 day return   apple  iphone  iphone8plus https   t co 5lvqoxzlxx"
"positive","editor rating 5 5 stars  teachers and parents are going to love bongo s spelling packs https   t co 9ooyotr9eb  via  https   t co hovvtehdhc"
"positive","rt  logan minard  wish i could start every day by cracking my  iphone with a  tech21 uk case protecting it   "
"neutral","spring breakers                             shotoniphone  iphone  longbeach  california  venice  santamonica  https   t co qomqnhirem"
"positive","rt  vip ent ceo    can  stream my  catching dreams   single on  spotify   https   t co m53bch2fqq   stay tuned for more  amp  on other  website "
"positive"," intel  scoffs at  report that its  5g  modems won t  be  ready for  apple s  2020  iphone  lineup  via  https   t co v7tk0otut7"
"positive","what s the best  twitter app for  iphone    9to5mac https   t co 1iorfhqlqj"
"positive","rt  jurassicapps  assassin vs mummies   match 3   free     iphone ipad version available now to play for   free   in all app stores itunes "
"positive"," applecard may reap  1 5 billion in revenue and be in top 10 card issuers by 2024  resulting in a windfall not just  https   t co znvm6yerbe"
"positive","rt  radim kacer  gradient  wallpaper  original  hdwallpaper for  phone  free  download https   t co tlvijnacoh    screen  fashion  iphone   "
"positive","rt  trinkwinkstore  our  giveaway is here   to celebrate the launch of our online store  we are giving away  apple  iphone xs 64gb of value "
"positive","  kings  queens  heroes  and fools   book two of the wardstone trilogy now on  kindleunlimited  kindle  https   t co 43qmbsal0p"
"positive"," select iphone cases on sale  buy now  https   t co zpjvyuwt6q dual layer pc hard back  amp  flexible silicone inner co  https   t co z94hpwndwb"
"positive","get free hipster  humanity  stickers   cute  blogger  iphone  ios10  texting  imessage  imessageapp  imessagesticker https   t co rnwtolw8ny"
"neutral","call or text now  714 678 8650  iphone  apple  samsung  mobile  andriod  htc  cellphone  orangecounty  orange  https   t co chtuthg8zn"
"positive","safari  evolution tv   apple tvos visit itunes now to download for   free  click copy below link for   free   downl  https   t co x4vdxzsiup"
"positive"," ripple and  xrp now supported on  ipad and  iphone ios  https   t co ppxujsypsp via  youtube"
"negative","digital marketing tips    update your  business details on  yelp    digitalmarketing  socialmedia  https   t co 5179w0eceh"
"negative","buy circle dragger   beware black dots and obstacles for  iphone  amp   ipad  itunes  appstoregames  https   t co 9j1ufw4koz"
"negative","rt  suhrmesa   progressive affectation  https   t co plj25evhiu   bretweinstein  ericrweinstein  jordanbpeterson  benshapiro  rubinreport   "
"positive","rt  gaincheap  20  off storewide software w  code at  imyfone  all  imyfone  softwares  amp   apps on  cleaner   itunes repairer   datarecovery "
"neutral","tchau  an ncios no  iphone sunday  it s april 07  2019 at 04 30pm https   t co gscbglavgs"
"neutral","                                            teamfollowback    teamfollowwack    iphone    tfbjp   teamhitfollow    ipod  dipromosikan"
"negative","new  android update makes my phone look like an  iphone  wtf  i have an android because i don t like iphone  guys  don t fuck with me"
"neutral","finally  there is a way to stop people from adding you to  whatsapp groups on  iphone and  android without your app  https   t co esanm9bqai"
"positive","i didn t dream it  it really happened      instagood  in  travel  photography  iphone  reflection  my  motivation  https   t co vzc8m8wzkv"
"neutral"," apple  iphone 6s  smartphone 16gb 64gb  128gb at amp t  verizon  unlocked t  mobile sprint  https   t co bxf6bawlzt pr  https   t co cdo1hk3arc"
"positive","cool tool i just learned about  gt  how to use  iphone widgets  tech https   t co ndrftfvf0y"
"positive","start playing paradise island  exotic on iphone https   t co jjqve4ifss  iphone  iphonegames  gameinsight https   t co py3qnxxbgo"
"positive","13   work hard on silent   iphone  ipad  clean  super fast   amp   slow  amp   lost   this unlocked        rt  apple  icloud https   t co wmfrn44tyt"
"neutral"," triptych 3 of 3   check out my page for the other 2 pics  ocean  caves  frazerbeach  budgewoi  centralcoast  nsw  https   t co c17fccxtkt"
"negative","proverbs trivia quiz   ios source code   https   t co r50ude1mkd via codester  triviaquiz  3wordguessing   iphone  https   t co z1ppzlij8p"
"positive","rt  justniklpikl  my one of a kind single edition solaris wallpaper from radim kacer  it s absolutely beautiful  and no one will ever have "
"positive","15 years flashback  eth   no  twitter  no  blockchain  no  iphone  no  tablet  no  energywebx in 2004   just  https   t co qkf6pzguzz"
"positive","rt  cmsconsumertech  lander iphone cases deliver peace of mind  minimalistic  lightweight  amp  protective for urban living  amp  off grid adventur "
"positive","yep  so don t stress it  god has a plan for you                              newyork  1  ny  truth  travel  https   t co d8mvzji4dw"
"positive","sim unlock  sprint  boost  att  tmobile iphone x 8 7 6  neterair  iphonex  iphone  swiftunlock  iphonex  unlockcode  https   t co dlqvbxgivk"
"negative","the pathetic  apple support forum practises continue  https   t co 3rxe0x2vsj  not good enough  tim cook  apple  iphone"
"positive","rt  5x5  new media group has lots of openings for computer geeks https   jobs cbc raleigh com  php  iphone  android  jobs  raleigh  nc come "
"positive","rt  fiorearcadesign  new iphone 8 mockup    red    psd  mockup https   t co vhpc5i9dv6   iphonered  iphone  ui  userinterface  iphonex  des "
"neutral","rt  ar72014   iphone  ipad  wallpapers  ios  homescreen    iphone2g clownfish stock  wallpaper modd for  ipad devices  download   https   t "
"positive","missing steve jobs   beautiful morning       stevejobs  apple  imac  iphone  iwatch   greater accra region https   t co pukh6chgal"
"negative","applemusic  apple  news  iphone  ipad  ios9 3  beta1 netflix app for ios no longer supports airplay because of  tec  https   t co qdgnnimkkp"
"neutral","guess the word   get the idiom  trivia  quizgame for  iphone  amp   ipad  itunes  appstore https   t co 8daglfzvkv  https   t co 4in61q0xzb"
"negative","i like the contrast on the horse s mane in this pic  shot and edited with   apple   iphone x https   t co vwcjyd4dnk"
"positive","  apple has cut  iphone prices in  china by nearly 6  in order to boost sales after seeing a lower than expected re  https   t co xsxkak765w"
