"Response","tweets"
"positive","upgraded my phone contract and got me an iphone yehaa    winning  blogger  iphone"
"neutral","get  comic  girl  stickers for  imessage  ios10  iphone  blogger  girlhero  girlsbelonghere  girlstakeover https   t co lrdw2qwp7h"
"positive","skin care pore vacuum machine iksmarkets   things and more shop   https   t co db18q66btq tag  follow and share   https   t co bjiliplifz"
"neutral","make the most of your apple watch  https   t co u4aqxlqcwl   applewatchseries4  applewatch4  applewatch5  https   t co 2eaqcdsykn"
"positive","so much fun today on a marathon 4 hours sup adventure on the algarve near lagos  redpaddleco first time out  loved  https   t co oc4wnk8g53"
"negative","   oh firebase  it s getting into my nerves now       appdev  appdevelopment  androiddev  ios12  iphone  https   t co swrucbsypi"
"positive","nowplaying   erik jackson   the midnight sun ft  joey crown  https   t co 6xyfg2isbo   iphone app https   t co csmu9adcyx   peripouwebradio"
"neutral","the 2019 iphone xi might look like this based on leaked images  iphone  iphonexi  https   t co irjhcvpegx"
"positive","best currency converter for  iphone   jpy  free  huf  sek  pln  fx  cad  aud  bgn  no  gbp  ios  czk  ltl  https   t co uiwi7e9dd1"
"positive","thanks  cem for the follow  check out our  unlockcode  icloud for  apple  iphone  samsung  lg  unlock  swiftunlock https   t co bemadlhtwd"
"neutral","rt  gextonphoto  the old bridge  luang prabang  laos     laos  luangprabang  travel  photography  iphone  perspective  oldbridge  bridge  t "
"positive","save trees  business  entrepreneur  api  js  css  success  ui  ux  webdesign  webdevepment  mobileapp  apple  https   t co ssq4qcwuj2"
"positive"," bible verse found with identity in christ daily by  roboticode for  android  iphone  kindle   dailyinspiration https   t co q8svzrdztv"
"positive","iphone 6 16gb  status  new  interested  dm for price   phone  iphone  gadgets  iphone6"
"negative","don t stop when it hurts  stop when you re done     fit5p    workoutmotivation  mondaymotivation  mondaymorning  https   t co ibh2lxvjgi"
"positive","rt  leehillerdesign                 hamsa on gold  tshirts  jewelry  iphone case  bags  onesie water  bottle  https   t co zqwvr9rtrc https "
"positive","microfiber screen lens square cleaning cloth  get it here     gt  https   t co cxmwjlzyp2    cellphone  iphone  mobile  https   t co bzbrztfmnh"
"neutral","rt  planexitoso   things that did not exist 15 years ago  today    uber   airbnb   snapchat   bitcoin   spotify   siri   google   chrome    "
"positive","what gliding swiping keyboard do you recommend for ios  i am missing this feature   seekingadvice  recommendations  help  iphone  ios  swype"
"positive","the next generation  you guys know what is this    iphone  apple https   t co btzcrpyvow"
"positive","rt  kinshirosama  hi folks     helpusout  followus  likeus  retweetus any help is appreciated and can help us grow   gothamiphone our price "
"neutral"," deals  14 99 usd   tracfone alcatel a405 flip prepaid cell phone https   t co ln5bed4guc  ebay  amazon  discount  https   t co 3r45fzbvz7"
"positive","original huawei honor 8x 20mp 4gb ram 64gb storage for only 240      https   t co 9cmj6msujc   shopping  https   t co odvjyxqgwv"
"positive","hey guys  kindle e reader https   t co hk4n7mbdkg  shopping  price  car  money  coupon  tv  video  aws  prime  https   t co 6jal8r6rmh"
"neutral","for most of us  starting off in the morning  your iphone wakes you up  you immediately start checking emails or tex  https   t co hzdkjdgvw8"
"positive","rt  techinrl  how to reset your airpods  https   t co adzofj0xth  airpods  airpods2  airpods2  airpods2  airpods  iphone  apple  technology"
"neutral","the schematic shows the lenses arranged in the same triangle shape alongside cutouts for the flash and the micropho  https   t co 7jrnbsnwnb"
"positive","check out apple iphone 7 plus   256gb   rose gold  at amp t   https   t co hp3rzhem67   bestebayprices    bid  gadgets  iphone  likenew"
"neutral","rt  ecenazssdestan  iphone telefonum     iphone not defterim   iphone  iphone7plus  iphonetelefon  iphonered https   t co hpdtpvaovq"
"neutral","41  off   sport2people running pouch belt  usa patented  runner waist pack  iphone x 6 7     https   t co qhfvt0lv7v https   t co xt3y37uu3i"
"positive"," 15 bucks a month   mint mobile phone plans   unlimited 4g lte talk  text  and data plans as low as  15 month   https   t co tm4wrcrjmt"
"positive","the best camera is the one you have with you  here s how to make the most of your  iphone camera on your next hike   https   t co xe5oxbinkq"
"neutral","bypass safari and chrome  read us on your applenews app  already on your  ios  homescreen   connectedhome  https   t co j40o2cybu0"
"negative","rt  ridheeshbhan  check my video about one plus 7 leaks here https   t co n7thvqvc1j  oneplus  iphone  photography  samsung  india  shotono "
"positive","a newly published survey of 8 600 u s  teens found that a higher number than ever  86 percent  are hoping to make  https   t co jczyjt2mr0"
"positive","iphone 7 plus free for you  complete information on how to get it  please click the link in our bio  this is very c  https   t co vasgcdh0ok"
"negative","xbox from  7 a week get the products you want today for a small weekly fee  tv s  settees  iphone  xbox  https   t co zsds7qohe5"
"positive","our  giveaway is here   to celebrate the launch of our online store  we are giving away  apple  iphone xs 64gb of v  https   t co quxb4uokfv"
"neutral","it s april 07  2019 at 05 00am   apple  iphone  unlocking prices has  dropped time  now to get it  unlocked swiftun  https   t co kjmgizjvaa"
"negative","me writes  i m a fucking genius  iphone autocorrect  you little nasty     gt   i m a ducking genius    meme  memes  https   t co 7rmawhzx8p"
"positive","went to mass at a local catholic college this evening  quick mass  but i saw two people on their  iphone texting du  https   t co hmxhhr9moa"
"positive"," manga  onepiece  anime  iphone onepiece wallpapers  fine pics for your iphone  https   t co ny7tcl76yx https   t co u5gw4b2vnh"
"positive"," bible verse found with words of jesus each day by  roboticode for  android  iphone  kindle   dailyinspiration https   t co 6o3dq59klf"
"positive","rt  mr loudpakk2  damn samsung sharing battery power now    iphone better come on wit it"
"neutral","rt  lorosullivan  a walk in the woods  nature  trees  iphone https   t co xffctnjgqx"
"positive","   online games       e onlinegames  com       play number of free  online  games    action   sports   puzzle    https   t co thkq9ylgfz"
"negative","apple event is on    https   t co apoyg8ppqv  lowest prices on apple products   iphones from  169  apple tvs  124   https   t co cgacukgyme"
"neutral","how to use airpods with android https   t co rsea4bnwf8  osx  ios  mac  iphone  ipad  tips  amp   tricks"
"positive","rt  katzdzynes  purple white school  volleyball team colors girly  otterbox  iphone x  case https   t co 4j6jqebgrx"
"positive"," iphone 360 full protection casing for iphone 5 5s http   phone accessories      https   t co kqkerrayen https   t co lsq2lpjito"
"positive","newly released iphone  amp  ipad apps   april 8  2019 https   t co fuza91j965  apps  deals  new  sale  free  iphone  https   t co epxsmd8pic"
"positive","cat6 patch cord 6 ft https   t co g87uptnwkc  imexx  new  florida  ventas  cables  audios  iphone  gadget  tech  https   t co powrplgkou"
"negative","one of many little known  iphone features  https   t co l8gmeelmzk"
"negative","rt  casey02042316  buyback icloud locked iphone  whatever it has any problem    badlcd  aftermarketscreen  nopower  waterdamage  missinglcd "
"positive","rt  techinrl  airpods user guide and tutorial   updated for ios 12   part 4  daily user tips  and bonus tricks  https   t co byyfxfc4sd  ai "
"neutral","short circuit on arc driver in iphone 7 plus         logicboard  phonetech  digitalforensic  iphone  ipad  https   t co 1wd8esuesz"
"neutral","rt  ongliong11   wallpapers  homescreen  lockscreen    wallpaper    iphonexsmax     iphonexr     iphonexs     iphonex   iphone    ongliong1 "
"positive","new  apple  iphone promotions at  sprint for april and may 2019  free iphones   150 prepaid mastercards  and more   https   t co g9hp1czf9k"
"positive","which of these updates are you most excited for with the new ios   apple  iphone  tech  ios  siri  airpods https   t co lramq1gv7s"
"positive","pizza jump  free now on  itunes  ios  iphone  pizza  appstore  games  indiegames  gamer  indiedev  https   t co dcillalrrs"
"neutral","two workarounds to delete multiple apple contacts at once https   t co izzuykejwr  iphone"
"positive","   nowplaying hanson   i will come to you from  tobiasvariano s  iphone by briptu rn ldd   music  polisi  cop  https   t co 4yhfxutiny"
"neutral","rt  wallsbyjfl   created by jfl  all formats  https   t co if2ulovkon  all walls  https   t co kle5ubpicb   homescreen  android  ios  iphon "
"positive","we would like to wish you an amazing day  make every minute count  tls  today  iphone  accessories  news  life  https   t co eipujybltf"
"positive","         brighton                       fun  live  love  instagood  brighton  photomaton  best  kiss  frenchkiss  https   t co 46ewo3tpgx"
"positive","also about to poly this one as well    finish  well  soccer  almost  home  isuzupup  wood  coke  pepsi  namaste  https   t co meyl0g0kve"
"neutral","how many  faces  can you find   disneylandparis  disneyparks  disneylandpark  disney  pinocchio  restaurant  https   t co h7ckorb2x0"
"positive","dental dream tooth  iphone xtreme tough case https   t co fsew1hb5gu via  thecatinblack  shopping  family https   t co idwsudb0vk"
"positive","r sole https   t co 7xk6cz5umu http    www redbubble com people what a shocker    tshirt  iphone  gift  birthday  redbubble"
"positive","my dog tracker and diary  app  ios  iphone  free pet training  health  amp  shots    free in the app store https   t co yp9ystigf2"
"positive","the best  iphone apps available right now  april 2019  https   t co nfwlmuwqhb"
"positive","in the end  i personally think that i will never upgrade from my  iphone6splus  i don t care if it cannot upgrade t  https   t co kuqsedzjpc"
"negative","lots of  youtubers  are bashing apple lately  lots of negativity coming from these people  if you ignore these peop  https   t co dsndxo0y14"
"neutral","what to do when your toddler disables your ipad for 47 5 years    insanenews  apple  ipad  ipadmini  iphone  https   t co j6l1btjb8n"
"neutral","i use this app all the time to scan in documents  manuals  recipes etc  it turns it into a  pdf that you can email  https   t co n6sby6xit2"
"positive","vice featuring mike taylor   world is our playground   splash365   the internet s best variety         https   t co xdztijtkaf"
"positive","poly on    looking  good  time  want  you  food  party  hi  namaste  yoga  pepsi  coke  whatwedew666  king  kregjig  https   t co jbjm3xdfrb"
"positive","rt  brieggers  biggest mistake ever was upgrading my  iphone  been on the phone all day with  applesupport because my new phone wants multi "
"positive","hey  ios  developers  i m a new  iphone user interested in learning  swift programming  i m now  blind  amp  using  https   t co 2rz825dzil"
"negative","help for  google  search  not working on my  iphone https   t co dhuhdm0vjq https   t co fn4tjxkoeo"
"neutral","                               1             while it s raining for 1 hr  but my iphone weather s app  forecase lik  https   t co wgov25unji"
"positive"," sell iphone 7 plus  new    128 gb   color available  silver and gold and red and black    last price  12 000  l e  https   t co cvaetludts"
"positive"," bible verse found with uplifting psalms daily by  roboticode for  android  iphone  kindle   dailyinspiration https   t co ybn10o7hip"
"positive","  nail      beautifulpeople  photo  nail  girl  hair  makeup  followme  cute                                    https   t co 3am3dhvmjf"
"neutral","it s april 08  2019 at 02 00am  still looking to  unlock  gsm  phone  xsmax xs xr  unlockfusion  unlocks  apple  https   t co mj9bqjyihl"
"positive"," iphonecase  iphone  apple  smartphonecase cute summer fruit pineapple blu ray iphone case just  15 22 https   t co iuv8ujedzo"
"neutral","future  iphone https   t co s6qkx7afwa"
"positive","applemusic  apple  news  iphone  ipad  ios9 3  beta1 whatsapp business app expands to iphone https   t co nh0wqliqze"
"negative","2 students in oregon returned thousands of fake iphones sent from china   which apple would replace with working ip  https   t co tirjewbvew"
"neutral","broken iphone screen  no problem  we can fix that   mobilemendz  iphone  brokenscreen  iphonerepairs https   t co k7f7jayvh8"
"negative","cacoteo radio no app needed to listen visit https   t co 85q6anhlc8 and hit play  iphone  android listen anywhere n  https   t co vtbg2lowup"
"neutral","64gb apple iphone x for  699 at gazelle  no contract  30 day return   apple  iphone  iphonex https   t co 7zwwxoyxxm"
"positive","https   t co q5xejhrkb7 stickling   sticker  maker  studio for the personal touch of your romantic chats  download  https   t co xt89szf8tz"
"positive","i have reached 29 level  i got  134000 and  4  https   t co 6cfbic8rui  gameinsight  iphonegames  iphone"
"neutral","sushi night  unilodgeaust  unilodge  studynt  boundlesspossible  darwin  australia  northernterritory  sushi  https   t co pfx2vios6l"
"positive","dear  apple  the numbers and emoji buttons are switched between landschape and portrait mode  why   apple  iphone  https   t co xnhcg3l5vo"
"neutral","during the first live  iphone presentation   stevejobs had to frequently switch phones behind his desk  otherwise   https   t co q2psl35leb"
"positive","what will you do with the new coming  applecard       gs  appl  iphone  survey   https   t co kcary2pc6n"
"positive"," giveaway   ipad  tahrir app   text on image    2 99 to free  on https   t co vgnwc0ugpg get the paid app for  free  https   t co v6gwdsbfix"
"positive","win an  iphone xs max   1 249      open worldwide        free  win  sweepstakes  giveaway  contest  sorteo  https   t co ctwl7w8pvi"
"neutral","6 string bass guitar bathroom selfie   why   why not     bass  bassguitar  guitar  music  6stringbass  music  https   t co wsvalaxvqe"
"negative"," rt  iphone  wallpapers  iphonexsmax  iphonexs  iphonexr  wallpaper  ios  homescreen  background  backgrounds   goo  https   t co etnxzrhkm1"
"positive","might switch back to  apple iphone  xs looks convincing  still having my  madebygoogle pixel 2  should i transfer o  https   t co f17zwpphky"
"neutral","price drop   yankai s triangle  on sale for  iphone  ipad  2 99  gt  gt   0 99 https   t co qzis4sozrx https   t co 507ns94n8b"
"positive","zombie fortress  dino   out now  download and play for iphone ipad now and play for free    copy quick link below   https   t co lrywvdphiw"
"positive","sim unlock  sprint  boost  att  tmobile iphone x 8 7 6  neterair  iphonex  iphone  swiftunlock  iphonex  unlockcode  https   t co 4ywgwwtr0v"
"positive","rt  digitaltrends  the best  iphone xs screen protectors https   t co yicfkf8fio"
"positive"," apple poaches another  ai expert from  google for its  special projects group https   t co 5g2bntzffp via  https   t co cevrvujqiy"
"positive","pretty  iphone  walking https   t co gureaf3q5y"
"neutral"," the wardstone trilogy  on  goodreads https   t co bta63gmebn  bookreviews  iartg   iphone  ipad  snrtg   rt"
"positive","florida power  amp  light is set to build the world s largest  solar powered battery  the capacity is the same as 100 m  https   t co y5xc2d2k5v"
"positive","the avanco hear   affordable bluetooth hearing aid earbuds   google  earbuds  android  news  hearingloss  iphone  https   t co bcyxf7mkql"
"positive","what s the best twitter app for iphone    9to5mac https   t co kco5cldapd via  googlenews  apple  twitter  tech  https   t co dwydvvsdve"
"positive","as we continue to emerge  let us design  scale  and implement  methodologies that will increase your organization s  https   t co 6mcfx3hrhm"
"positive","rt  oktopolisart    warning   be prepared to receive endless compliments when you upgrade to this phone case by  oktopolisart  amp   hificolor "
"negative","two students allegedly cheated apple out of nearly  900 000 in fake  iphone scheme   npr https   t co a1immnikjx https   t co uxlvzebgvb"
"positive","the avanco hear   affordable hearing aid earbuds   google  earbuds  android  news  hearingloss  iphone  gadgets  https   t co hxsbbfne0c"
"positive","rt  forestanonymous  another great game that is amazing with  gamevice us  spacemarshalls2   if you don t wanna wait for  nintendoswitch po "
"neutral","rt  hk3ton   wallpapers  iphone  geometric  lockscreen  apple  abstract  devices  homescreen  geometric  wallpapers for        iphonex "
"negative","buy proverbs trivia quiz for  iphone  amp   ipad  itunes  appstoregames https   t co 27gobza3is  chupamobile by  saappsofficial"
"neutral"," path  lvmh  chevalblanccourchevel  courchevel  courchevel1850  3vallees  bouquinpork  photography  iphone  physio  https   t co e7my4emsrj"
"negative","rt  steveocook  the final night at dukes  shoot pool   aylesbury the last bands to play towers of london screamin  irene number 38 and teva "
"positive","elegant and colorful austrian crystal fashion jewelry set iksmarkets   things and more shop    https   t co kaj7lvd0oc"
"positive"," google has finally planned to introduce what  iphone users were enjoying for years    https   t co fvho5nnd8a  https   t co fugz6dr1ij"
"positive","intel scoffs at report that its 5g modems won t be ready for apple s 2020 iphone lineup https   t co 1kcnd36dj3 via  https   t co aqeaxazajb"
"positive","      rip king       kingcrowley  king  kushking  ink  iphone  loud  loyalty  pothead  producer  photooftheday  https   t co g2zwqr09x2"
"positive"," release item    rottencity iphone case   color   gold silver red size   6 6s 7 8  x  price   3 800  tax out       https   t co mfpyvrktqq"
"positive"," lottery  iphone amazing lotto app   this is awesome app  lottomega https   t co ud1avjmnua"
"neutral","rt  thestellaprize  a short  iphone video grab of louise swinn  chair of the  2019stellaprize judging panel  discussing this year s shortli "
"neutral","how to change siri voice on mac to different gender or accent https   t co fvbhoiva3r  osx  ios  mac  iphone  ipad  tips  amp   tricks"
"neutral","138 users just unfollowed me  via  findunfollower https   t co athsexspam   iphone  app"
"positive","price drop   your gps location finder   on sale for  iphone  ipad  1 99  gt  gt  free https   t co pwl4zidvu5 https   t co ql4dardcdl"
"positive","check out new sketchers universal sweat proof armband    iphone https   t co ytbdiiweyw   ebay   summer  love  https   t co kxexv9i4ie"
"positive","how does it work  quite easy actually  as it does most of the hard work for you   googleduplex  google  iphone  https   t co aud334hjhi"
"positive","test your love   https   t co tglgk6x1zm  itunes  love  apps  lovetest  funny  fun  iphone  ipad  newapp  ios  https   t co 6gus30akbq"
"positive","more ios texting packs coming tomorrow   be sure to check out the new ones listed in the app store today  https   t co 791preqyyj"
"neutral","rt   korke   tweak   glacier    give the ios cc a transparent ui     no settings  condition     100  work    iphone 6s  ios 12 1 2   jailbr "
"negative"," android smartphones haven t beaten the  iphone but are narrowing the gap  suggests cowen analysts  with  huawei an  https   t co 0nwcqk4o8p"
"positive","the incredible shrinking apple  yeesh  via  theloop  iphone https   t co 4ohu98muen https   t co qogoqv1unq"
"positive","did you know  your  iphone has a  magnifier to help you see things better   https   t co kfusr7m3bc"
"neutral","display comparison between galaxy s10 plus and iphone xs max  samsung  galaxys10plus  iphone  iphonexsmax https   t co 3850pwo7ee"
"positive","did some tech support for my neighbor  she just needed the ink in her printer changed out  it was pretty easy for m  https   t co xh9tzvmuge"
"positive","rt  gaultierchantal  dear  americans  it is not time to prepare for  easter celebrations  nor to sit in front of the tv  or buy a new  ipho "
"positive","what is the deal   iphone  data https   t co xmmftnauaf"
"positive","how to buy the best iphone spare parts  gt  gt  gt  https   t co q95telakqz  iphone  iphonerepair  iphoneparts  iphonexs  https   t co fwp1k0e8oc"
"positive","me trying to explain to myself the ending of  the oa absolutely brilliant stuff  probably a 2 year wait  for season  https   t co 0bfgkfce64"
"positive","25 best free  iphone apps for business https   t co pqwodpvawy  social  marketing  productivity"
"positive"," cacoteoradio la primera emisora de reggaeton en linea a nivel mundial 24 7    visit https   t co 85q6anhlc8 and hi  https   t co x3llszzecj"
"neutral","frank robinson s  20 on device cases  shirts  hoodies  bags   stickers  amp  more   orioles  baltimore  birdland  https   t co t6qlxfrmie"
"negative","applemusic  apple  news  iphone  ipad  ios9 3  beta1 wsj  apple music has overtaken spotify in u s  paid subscribers https   t co 1rvbzxx9pf"
"positive","thanks for following us on twitter  check out our app page   https   t co v1kwptazw0 to see our new apps  freeapps  https   t co urrrbb6exo"
"neutral","health     iphone activity  thursday april 4 walking  running     steps distance  flights    climbed for erica n  f  https   t co 6309kwne6u"
"negative","nowplaying   broke for free   as colourful as ever  https   t co 6xyfg2isbo   iphone app https   t co csmu9adcyx   peripouwebradio"
"negative","play hipster  hangman with  friends   games  blogger  iphone  ios10  texting  imessage  imessageapp  imessagesticker https   t co uboo9b2tzi"
"positive","on my  ios  iphone  having the ability to compile  swift code is therapy for my  blindness  just coding  amp  enhancing  https   t co roxzzgore7"
"negative","omg i just learned i can  type 0  c now   the little   is hidden on 0 long press  had no idea all this time  iphone"
"negative","ok  so i left my office with minimal gear  since i knew i would be back early  unfortunately this did not include  https   t co jxnkxal4if"
"neutral","rt  key2le  starting today   orange is offering the blackberry  key2le in champagne  grab the exclusive 64 gb dual sim version at the link "
"negative","legacy family tree webinars   no purchase necessary  free genealogy tools for your ipad iphone https   t co wmu2fxg2tj  genealogy  iphone"
"neutral","coffee and writing seem to go hand in hand   writersofinstagram  writing  writingcommunity  writersblock  coffee  https   t co 8sd7n6fg0g"
"positive","20  off storewide software w  code at  imyfone  all  imyfone  softwares  amp   apps on  cleaner   itunes repairer   https   t co kt83vec6q7"
"neutral","i m probably the world s 1st  blind person that bought an  iphone exclusively for  ios  swift development  ha ha ha   d"
"positive","fri yay photoshoot with the best girl     kimber  adventureswithkimber  dogsofinstagram  iphone   platte city  miss  https   t co cqejzd6np6"
"positive","buy tik tak toe pro   turn based family game https   t co 1dyem9bvpo for  iphone  amp   ipad  itunes  appstoregames  https   t co 7joj0mw4qu"
"positive"," giveaway   ios  ijumper  99c to free  on https   t co kzsfh9x39l get the paid app for  free  today only  iosapps  https   t co gnznybeowj"
"negative","do not know how to download apps over 150mb or 100mb without wifi on iphone  here s the trick for you    https   t co 9atejrupqa"
"positive","during my presentations i share with the audience i practically work from my phone 80 90  of the time  i get snigge  https   t co uewd4cx3h9"
"positive","love fish  get  geometric  fish  stickers   blogger  iphone  ios10  texting  imessage  imessageapp  imessagesticker https   t co gif8txxpcy"
"positive","win an hp sprocket plus to print your mobile snaps on the go       enter here   https   t co ads9yd8oxs     comp  https   t co qbl9fr3zef"
"neutral"," apple  iphone 8 plus  at amp t  64gb   space gra    by apple computer for  669 00 https   t co eazvrvjvsb"
"negative","my delayed flight is just teasing me as it sits on the tarmac   to top it off  the bar in the airport can t deal al  https   t co qurb3zcesj"
"positive","oregon engineering students from china  made almost  1million by claiming 1 500 fake iphones didn t work so they co  https   t co rbwxfzqftl"
"neutral","rt  whatsdadeal2  4 pack of apple certified braided iphone cables                                get it for  8 40       1  go to  gt  https    "
"negative","rt  kevinfeeds   apple xs max on verizon dropping calls constantly  on third phone  even though many others complain about this sane issue  "
"negative","rt  waterpediawiki  here is a breakdown of revenue streams of largest technology giants like  apple  amazon  alphabet  google  microsoft  w "
"positive","iphone 7 plus free for you  complete information on how to get it  please click the link in our bio  this is very c  https   t co 7joxyprxni"
"negative","cacoteo radio no app needed to listen visit https   t co 85q6anhlc8 and hit play  iphone  android listen anywhere n  https   t co x5f2wqwad8"
"positive"," birmingham  gasstbasin  city  boats  canal  narrowboat  reflections  iphone   birmingham  united kingdom https   t co 9mou5v2ryh"
"positive","rt  transunitynow  introducing our  free  transgender  dating  app for  android  https   t co 7qp2u3xsvp  android  iphone  ios  samsung  sm "
"negative","dns  cloudflare warp vpn explained in tamil https   t co pnfwnjszxn   apple  iphone  ipad  tech  tamil  cloud  https   t co xn8andsak5"
"positive","30 amazing steve jobs quotes to motivate you https   t co 0i72x3rkqe via  imbhawnak   stevejobs  timapple  apple  https   t co pldu8ec8rs"
