"Response","tweets"
"negative","rt  hovellinghermit  are you an  apple  iphone owner with a water damaged phone  apple will tell you that you have lost your data for good  "
"positive","what these amazing products click the click here and shop my store of artwork   https   t co iodcwi70v7  store  https   t co ytxsd5y8cp"
"positive","morning babies i m online all day giving away iphone xmas first 20 babies to like  rt  and follow stand the chance  https   t co ig6autz7sb"
"positive","flying pet cockatiel parrot  iphone case https   t co ghqhwycy2f via  thecatinblack   iphone case  shopping https   t co miukzwptvg"
"neutral","rt  ncceducation  during the first live  iphone presentation   stevejobs had to frequently switch phones behind his desk  otherwise  it wou "
"positive","rt  chrisdof  missing steve jobs   beautiful morning       stevejobs  apple  imac  iphone  iwatch   greater accra region https   t co pukh6 "
"positive","budgie parrots in ferns  iphone case https   t co dtpe2bgspb via  thecatinblack  technology  gifts https   t co uctkoig6yt"
"negative","cockatiels in forget me nots  iphone case https   t co rpl2pxyutv via  thecatinblack  tech  phone https   t co ozkzze6c5e"
"positive","found this with prayers  amp  blessings daily by  roboticode for  android  iphone  kindle   dailyinspiration https   t co cq7i8vznch"
"positive","good morning from  hutchinson  island  florida  iphone  stormhour  weatherchannel  realsaltlife  spann  usasunrise https   t co 1tsy8sx7ul"
"negative"," android smartphones haven t beaten the  iphone but are narrowing the gap  suggests cowen analysts  with  huawei an  https   t co 9nglxtzg1k"
"negative"," android smartphones haven t beaten the  iphone but are narrowing the gap  suggests cowen analysts  with  huawei an  https   t co 0nwcqk4o8p"
"positive","finally  iphone 7 no probs   everything good    here s hoping apple keeps to this level of software quality   ios12  https   t co nidbyreqqn"
"negative"," android smartphones haven t beaten the  iphone but are narrowing the gap  suggests cowen analysts  with  huawei an  https   t co cgi9qe06ux"
"positive","rt  jin store  the next generation  you guys know what is this    iphone  apple https   t co btzcrpyvow"
"positive","rt  technology lte  the startup that secretly runs the internet just got acquired by one of its biggest rivals for  670 million  matt weinb "
"positive","the startup that secretly runs the internet just got acquired by one of its biggest rivals for  670 million  matt w  https   t co kph6suhwvg"
"positive","the startup that secretly runs the internet just got acquired by one of its biggest rivals for  670 million  matt w  https   t co ic3zktvcib"
"positive","the startup that secretly runs the internet just got acquired by one of its biggest rivals for  670 million  matt w  https   t co dy1n8iuljq"
"positive","siri  i m pretty sure you re prematurely excited about that extra hours sleep tomorrow night  daylight savings in a  https   t co eegc5x7x0d"
"positive","rt  radim kacer  minimalist  wallpaper  original  hdwallpaper for  phone  free  download https   t co tlvijnacoh     screen  fashion  iphon "
"positive"," autism  mom  unbreakable now  available https   t co jwoleetnac  mug  totebag  iphone  case autism  awareness  https   t co 3hf4hn2zqy"
"positive","came spring  blooming cherry blossoms   it s beautifully japan   japan  japanese  japan of insta  flowers  spring  https   t co expat2kfhe"
"positive","rt  sgtalcastro  facing waning  iphone sales  apple is looking for future lucrative business  apple is launching a credit card and boosting "
"neutral","is it just a coincidence or is your phone listening to you  https   t co rbxqynzcz2  phones  apps  advertising  https   t co eioaqmgeic"
"positive","apple arcade   apple event march 25  2019   https   t co 3tfaqhfahq   appleevent                 applearcade  https   t co gmd7jeyxpb"
"neutral","during the first live  iphone presentation   stevejobs had to frequently switch phones behind his desk  otherwise   https   t co q2psl35leb"
"negative","smart cool hikone iphone repair shop at hikone city  shiga in japan  we can fix iphone issues  screen cracked batte  https   t co otdifslpvp"
"positive","rt  platinumrepairs  take advantage of our low prices on screen repairs for the iphone 8  amp  8plus  give us a call on 010 594 7588  or email "
"neutral","be nothing more than gangsters  download the application mysterius with your friends   applestore    https   t co xfv0dlbti0"
"neutral","me at a buffet  cat  ctto  feline  catlovers  wanderlust  pet  pets  mustlovecats  memes  furball  iphone  https   t co mx2y6f9vpo"
"positive","avail the excellent rs 17 000  discount and 10  5   cashback from hdfc bank on  apple  iphone xr at poorvika mobile  https   t co tjnltclolg"
"positive","the final japan photo        redpumpkin  yayoikusama  naoshima  japan  travel  seetheworld  art  contemporaryart  https   t co hrjbpkb409"
"positive","iphone  amp  ipad app price drops   april 5  2019 https   t co u07gidspwb  apps  deals  new  sale  free  iphone  ipad https   t co tyif5vfpgg"
"positive","iphone  amp  ipad apps gone free   april 5  2019 https   t co 30lqhaom0a  apps  deals  new  sale  free  iphone  ipad https   t co w0il70hbau"
"positive","newly released iphone  amp  ipad apps   april 5  2019 https   t co cxxdgijxam  apps  deals  new  sale  free  iphone  https   t co larqjvzr04"
"neutral"," deals  684 99 usd   apple iphone x   64gb   silver   factory gsm unlocked at amp t   t mobile smartphone  https   t co nzumuziudp"
"positive","hey there  you should come and checkout our new products  sonny apples and all the others  sony  apple  iphone  https   t co gxmbsw78zo"
"positive","bergerac here we come    transavia  france  flying  boeing  b737  green  rotterdam  blue  sky  airport  iphone  https   t co lfvq8mpcis"
"positive","rt  alexparks525   15 bucks a month   mint mobile phone plans   unlimited 4g lte talk  text  and data plans as low as  15 month  https   t  "
"positive"," bible verse found with words of apostles daily by  roboticode for  android  iphone  kindle   dailyinspiration https   t co egeeiuttk2"
"positive"," bible verse found with wise proverbs daily by  roboticode for  android  iphone  kindle   dailyinspiration https   t co el0ko4fcnx"
"positive","interesting that my gut feeling that 100  of doctors are  iphone users is in fact wrong  read by  qxmd  analytics s  https   t co 0xjcws57vk"
"positive","take advantage of our low prices on screen repairs for the iphone 8  amp  8plus  give us a call on 010 594 7588  or ema  https   t co j641vtifvz"
"positive","need to replace microsoft band for iphone   stepwise lets you keep track of your daily steps and is available for f  https   t co nhmaesl0pd"
"negative","are you an  apple  iphone owner with a water damaged phone  apple will tell you that you have lost your data for go  https   t co zsagxjpk4k"
"positive","missing steve jobs   beautiful morning       stevejobs  apple  imac  iphone  iwatch   greater accra region https   t co pukh6chgal"
"positive"," bible verse found with words of jesus each day by  roboticode for  android  iphone  kindle   dailyinspiration https   t co ljlicbtw5k"
"positive","tech armor iphone x ballistic glass complete protection get yours here  https   t co nf0qqr1yqz    iphone x glass c  https   t co tsq9crzgxd"
"positive"," hey siri  ignore the lock screen    gt it s really easy to message anyone from a locked  iphone even if it s not your  https   t co azfsuxcohr"
"positive","rt  babyboypics  happy friday it s go time  have an awesome day                         newyork  newjersey  brooklyn  nyc  ny  apple  trave "
"positive"," it will arrive at your door repackaged in a certified box and with the appropriate charger    https   t co pjt1oxwnvj"
"positive","prefer to keep your  iphone for a few years   great   we ve got accessories for many years models  https   t co 4dueimyz29"
"positive","when will an  iphone bring you money  exactly   werlaunch  lemonadestand enabled iphone app to start your business  https   t co 10iwvqgzfp"
"positive","hey guys  sports  amp  fitness in https   t co rpgttodmsn  shopping  price  money  coupon  tv  car  video  aws  prime  https   t co ulzbdrpgco"
"positive","premium quality phone skins click gt  https   t co pahspm0y1x  iphone6  iphone  samsung  tablet  apple  tablet https   t co cxyegsj92d"
"neutral"," wallpapers  iphone  geometric  lockscreen  apple  abstract  devices  homescreen  geometric  wallpapers for   https   t co ms6y4ehzi4"
"neutral"," wallpapers  iphone  geometric  lockscreen  apple  abstract  devices  homescreen  geometric  wallpapers for   https   t co b8vdi1zpwz"
"neutral"," wallpapers  iphone  geometric  lockscreen  apple  abstract  devices  homescreen  geometric  wallpapers for   https   t co 2bqpmmnbnc"
"neutral","rt  majoihart  intensity by majoih    artscase    artscase eu  https   t co ibec4sgwk7     iphone  iphones  iphonex  iphonecase  protectyou "
"negative","every single one of us is entitled to be our true self  without judgments and finger pointing   https   t co cckfpovked"
"neutral","rt  infltr app  the iphone s camera used to be a selling point  https   t co 2glbi2ciot   iphone  camera  photography  fridayfeeling  marke "
"positive","  nail      beautifulpeople  photo  nail  girl  hair  makeup  followme  cute                                    https   t co 3am3dhvmjf"
"positive","pop up with audio  fredsanford voice  ya gotta wash your ass   gee thanks  iphone    sdcc2019 https   t co rfeflqmzs0"
"positive","rt  appwebstudios  be a wise man  business  entrepreneur  api  js  css  success  ui  ux  webdesign  webdevepment  mobileapp  apple  iphone "
"positive","rt  jurassicapps   brand new release assassin vs mummies match 3  mac   version visit mac app store now to download for  free  click copy b "
"positive","be a wise man  business  entrepreneur  api  js  css  success  ui  ux  webdesign  webdevepment  mobileapp  apple  https   t co qakqggh9bq"
"positive"," freelance  freelancing  freelancer  technology  news  information  computer  cyber  world  internet  iphone  https   t co mlsv8de3xm"
"negative","applemusic  apple  news  iphone  ipad  ios9 3  beta1 skype doubles group call limit to 50  overtakes facetime s max  https   t co erjubdbcyu"
"positive","websms for  iphone  write sms on pc mac via  iphone  ios  sms  free  switchrts  https   t co 9azj2ifald"
"negative","trans people face daily challenges unimaginable to a lot of us and that s why we want to discuss this and ask for y  https   t co hizldyitfc"
"positive","the  apple 10 5 inch ipad pro is immensely powerful  amp  equipped with great performance  call  08140000114  https   t co z0l1cct8xp"
"positive","looks like the fakedroids were all hype    as usual   samsung  android  iphone https   t co s3bxlqz7nr"
"neutral"," subway  surfers app apes review  https   t co khx7e8kn39  apple  ios  ipad  iphone"
"positive","baguette       baking  boulangiere  chef  baker  fresh  baguette  france  paris  pain  bread  sourdough  culture  https   t co dj5kqmgrsa"
"positive","still can t get over how well these cases have been received by our customers  so much love for the military grade  https   t co fhspwa714k"
"positive"," bible verse found with uplifting psalms daily by  roboticode for  android  iphone  kindle   dailyinspiration https   t co gdmjjgbsoa"
"negative"," jonnyevans cw explains what s likely  less likely  and unlikely in this 2019  iphone rumor guide   https   t co ymnescdslk"
"positive","rt  ndhunay  i love using my  android phone to tap and pay for purchases  i simply unlock the phone  amp  tap  this morning i saw someone use a "
"positive","our  phoneoftheday is this lovely  apple  iphone 6 with 64gb of storage and unlocked to all networks   looking to u  https   t co pefbj6fwa8"
"positive","happy friday it s go time  have an awesome day                         newyork  newjersey  brooklyn  nyc  ny  apple  https   t co iqxs6kbhqb"
"neutral","at  work and can t  think  you re wound up    here s how to unwind in your  dream  diary  journal for  iphone  ipad  https   t co z5zbbuwlzo"
"positive","seeing as  apple  iphone is probably the main reason i have thousands of dollars of apple products and accessories   https   t co ew3smkinsx"
"positive","rt  fit5p  start  healthyliving today with  fit5p   fit5  exercise  iosapps  app  ios  iphone  appstore  ipad  itunes  dietplan  weightloss "
"negative","rt  pokdedotnet  guy 1  there s no way that a big company like apple can get scammed easily guy 2  hold my cendol   apple  iphone  scam  co "
"negative","has anyone found any issues with ios update 12 2   iphone"
"positive","what s the best browser for  iphone  we compare 7 apps so you don t have to  https   t co vhbnwqcjsn"
"positive"," bible verse found with identity in christ daily by  roboticode for  android  iphone  kindle   dailyinspiration https   t co neiwgknj3j"
"positive","10 key benefits of swift for ios app development  swift  ios  iosdev  swiftlang  iphone  objectivec  apple  https   t co cbhsttq6xl"
"neutral","whatsapp s business app comes to the iphone   techcrunch https   t co flvzjgikgm via  googlenews  whatsapp  tech  https   t co godjnrhscj"
"positive","win an hp sprocket plus to print your mobile snaps on the go       enter here   https   t co q9cw4cybau     comp  https   t co tsnpjjbuar"
"positive"," electronics  smart  anime  tech  phone  fitness  hiking  camp  manga  iron  man  news  sports  charger  iphone  https   t co wffpir6h1b"
"positive","found this with prayers  amp  blessings daily by  roboticode for  android  iphone  kindle   dailyinspiration https   t co yiqapbsjn5"
"neutral","rt  keerthy1995   apple s dropping price s of  iphone s https   t co arxfthza4e  pubg mobile  pubg    pubg      pubgclips  pubggad  pubgmhb "
"negative"," apple s dropping price s of  iphone s https   t co arxfthza4e  pubg mobile  pubg    pubg      pubgclips  pubggad  https   t co mkflfu8maw"
"positive","rt  intechent  can we sit back and admire apple and other phone companies for how expansive and impressive the camera applications have bec "
"neutral"," whatsapp  ios business app goes live for  iphone     xanjero https   t co zdkhmcpc0w https   t co fpbhb8uahy"
"neutral"," whatsapp  ios business app goes live for  iphone     xanjero https   t co sd6ki4rnvs https   t co hi659zs0kg"
"positive"," bible verse found with identity in christ daily by  roboticode for  android  iphone  kindle   dailyinspiration https   t co 7eiq8yjtma"
"positive"," whatsappsbusiness  app is today launching on  iphone  main goal is to help small business owners to reach their  https   t co uqt53hkae9"
"positive","can we sit back and admire apple and other phone companies for how expansive and impressive the camera applications  https   t co baizecw0bf"
"positive","price drop   dot line  on sale for  iphone  ipad  0 99  gt  gt  free https   t co t5082aygwi https   t co 1j3ppdtn2y"
"positive","r sole https   t co 7xk6cz5umu http    www redbubble com people what a shocker    tshirt  iphone  gift  birthday  redbubble"
"positive","start  healthyliving today with  fit5p   fit5  exercise  iosapps  app  ios  iphone  appstore  ipad  itunes  https   t co fy7ex0l4tt"
"positive","as you begin your friday remember good things take time                            newyork  1  ny  truth  travel  https   t co shriyacr5n"
"positive","i love siamese cats  iphone case https   t co x244c2vrvr via  thecatinblack   iphone case  shopping https   t co 0e7yxtg1vi"
"positive","colorful coral reef fish  iphone case https   t co an45azezdz via  thecatinblack  phone  shopping https   t co af2d39c6e8"
"neutral","chicken satay          follow   manavpiplani        picoftheday  likesforlikes  sodelhi  nom  indianfood  platter  https   t co ir7kmxvtxq"
"positive"," bible verse found with prayers  amp  blessings daily by  roboticode for  android  iphone  kindle   dailyinspiration https   t co 8mqikmapic"
"positive","how many people are  applemusic    iphone   mac  lover  if yes then this for you    6  cashback itunes purchase     https   t co oo5x7ngciu"
"positive","new samsung galaxy s10 128gb available   290 000   samsung  android  s10  galaxy  galaxys10  apple  iphone  https   t co 7z6m1wtmyj"
"neutral","rick goes to    china    lego  legomoc  legofan  legophotography  legostagram  afol  chinanewyear  melbourne  https   t co gmxzowowim"
"positive","free iphone mockups made by  extravaganso   mockup  iphone  iphonemockup https   t co ma9g8ipjp1"
"positive","best and worst time to eat apples    apples  apple  food  fruit  fruits  iphone  yummy  healthyfood  healthy  https   t co lbqhnjrtjj"
"neutral"," ocean  yullumgocove  eden  southeastcoast  nsw  visitnsw  destinationnsw  tourismnsw  exploreaustralia  travelnsw  https   t co ifqu1rhhf1"
"positive","apple s shocking new  iphone design makes sense https   t co run51ebuec"
"neutral","rt  evankirstel  lines of  software code required to run the  space shuttle  your  iphone and  google    wef ht  mikequindazzi  emergingtec "
"positive","rt  leehillerdesign                 hamsa on gold  tshirts  hats  cufflinks  iphone case  tie  flask  onesie  https   t co zqwvr9rtrc https "
"positive","rt  device world1  glitter marble case for iphone xsmax xs x 8plus 7plus 7 8      0202024981 60cedis pickup delivery available  site15  iph "
"positive"," yjaswrites  ffcbookclub  apple  applestores  applesupport  appleuk    appleuk  wow  for such a big company surely  https   t co bxcgsx1jss"
"positive","guy 1  there s no way that a big company like apple can get scammed easily guy 2  hold my cendol   apple  iphone  https   t co whgaamqnic"
"negative"," yjaswrites  apple  applestores  applesupport  appleuk    appleuk  noooooo way     surely that s not right  wow   i  https   t co 3zhs4j44tu"
"positive","applemusic  apple  news  iphone  ipad  ios9 3  beta1 apple music subscription prices slashed in india https   t co 9szoe9dhlk"
"positive","https   t co eg4tvzyupf apple iphone xr  256gb  red m r p   91 900 00  price  74 900 00  you save  17 000 00  18    https   t co vygjfujal0"
"negative"," yjaswrites  apple  applestores ooh     this is awful and as an artist i can imagine the inconvenience this is caus  https   t co qbwav7rc6y"
"positive","rt  cmarixtechlabs  what are the principal differences between ios and android to consider when building apps with react native  https   t  "
"positive","hey guys  fashion in https   t co rpgttodmsn  shopping  price  money  coupon  tv  video  car  aws  prime  https   t co jhaluvadrq"
"neutral","get  comic  girl  stickers for  imessage  ios10  iphone  blogger  girlhero  girlsbelonghere  girlstakeover https   t co lrdw2qwp7h"
"positive","crystal sunset photography  https   t co qd9ogqphok   crystal  sunset  photography  beautiful  sun  iphoneography  https   t co kclzxq86vz"
"positive"," reading on your phone made easier and faster with our seeoo light attached to your  iphone   choose the color for  https   t co ye9fsq99bf"
"positive","amazon music unlimited  promozione per tre mesi gratis  https   t co puhhv2hkwy  apple  ios  iphone"
"positive"," apple s shocking new  iphone  design makes sense https   t co tcsduze0j3"
"negative"," kayosports your app is broken    androidtv  iphone and  appletv  wtf"
"neutral"," wallpapers  iphone   iphonexsmax  iphonexs  iphonex  iphonexr   virtual paper  wallpaper for    iphone xs max   ip  https   t co ljvzw6kgdu"
"positive","opula software   leading mobile app development company in surat offers android  iphone  ios and windows mobiles ap  https   t co m5mkotvxfl"
"negative","rt  ridheeshbhan  check my video about one plus 7 leaks here https   t co n7thvqvc1j  oneplus  iphone  photography  samsung  india  shotono "
"positive","morning guys   me  myself  selfie  morning  goodmorning  man  guy  boy  teen  instaboy  instaguy  instaman  https   t co stigarnqjz"
"negative","rt  imagictrickapp  imagic trick on the  appstore https   t co vujmyshcfn  magic for the  iphone   ipad and  applewatch"
"positive","get 10  off all iphone 7 and 7 plus  at https   t co kehonzpvbj    discount only valid until 7th april so act fast   https   t co mfbdsgjbg5"
"neutral","fix iphone  ipad keeps disconnecting from usb with pc or mac  tamil  https   t co hvthn1xv4h   iphone  apple  tamil  https   t co b8copdz1mn"
"positive","rt  capackermann  unboxing iphone xr      https   t co 1h6gkjpnw3  luxe  luxury  girl  style  unboxing  lifestyle  fashion  love  hightech "
"neutral","rt  karetniy  hand holds the smartphone with skype application on the screen    https   t co 1ut4swa1t6   ios  https   t co idj2necab7"
"neutral","it s april 05  2019 at 05 01am   apple  iphone  unlocking prices has  dropped time  now to get it  unlocked swiftun  https   t co l0yszaa2pf"
"neutral","itunes taking forever to sign in  how to fix  anybody   help  iphone  ios  howtofix  itunes  troubleshoot"
"positive","               hamsa on gold  tshirts  hats  cufflinks  iphone case  tie  flask  onesie  https   t co zqwvr9rtrc https   t co 2oodo9tbqv"
"neutral","my phone is sending secret texts and i don t know to who or what it is sending  i just see this screen popping up e  https   t co a5msmwgxu9"
"positive","women s jeggings  allen solly womens slim jeans slim fit  inseam  30 inches  jeggings solid pattern shop    https   t co qxsimyfid0"
"neutral"," pylons  whitecappedpylons  yachts  boats  buildings  docklands  melbourne  vic  visitvictoria  explorevictoria  https   t co k234fnbwdl"
"positive","we are constantly improving our app and adding new features  we re currently testing  gastgo version 1 04 which wil  https   t co 46vk31uxhv"
"positive","glitter marble case for iphone xsmax xs x 8plus 7plus 7 8      0202024981 60cedis pickup delivery available  site15  https   t co yb51bgjcis"
"positive","rt  ramaraobobby  how to restore iphone from icloud backup   ios  iphone  icloud  tips  https   t co rwhghzobnb"
"negative","cacoteo radio no app needed to listen visit https   t co 85q6anhlc8 and hit play  iphone  android listen anywhere n  https   t co lqzyidwgzx"
"neutral","college students allegedly scammed apple out of nearly  1m in iphone replacements   the verge  https   t co 5h1rvc1hf8"
"neutral","otterbox case apple iphone cases   usa flag      https   t co 0jezyn0ly4 via  zazzle   usa  otterbox  apple  iphone  https   t co 6vxpyrkqnk"
"neutral","magnetic finger holder case cover for iphone x xs max xr 5 5s se 6 6s 7 8 plus  case  iphone  iphonecases  https   t co hqbeo0dqvd"
"positive","so  apple does the internet censorship now   wow    apple  iphone  https   t co lj36cobqjb"
"positive","love  unicorns  get our glittered  stickers for  text  ios10  iphone  blogger  animals  horses  message  iphone7 https   t co uavxauenwg"
"positive"," caseyneistat  mkbhd i hope you did not  tweet on your  iphone or  samsung "
"positive","somewhere in the coast    iphone  photography https   t co z34ryf1dky"
"neutral"," nofilter  sydney evenings    iphone  onecityatatime  australia  businesswithpleasure  worldwelltraveled   sydney   https   t co oz4aq8n5pc"
"positive"," giveaway   ios  ez domino score keeping pad  99c to free  on https   t co ryxbaknjup get the paid app for  free  https   t co zo9jeomqio"
"negative","injustice   gods  among  us app apes review  https   t co 7xvjydwor8  apple  injustice  ios  ipad  iphone"
"positive","rt  jpgmag   imagine an iphone that never dies    https   t co ypag6qdxqo  iphone  photography https   t co 25lktmrpxp"
"positive","the time is ticking for a new iphone with wow factor to blow us away   iphone  https   t co bh11zdkzih"
"positive","powerbeats pro vs  airpods 2  quali sono le differenze  https   t co rso39nhs42  apple  ios  iphone"
"neutral","the iphone s camera used to be a selling point  https   t co 2glbi2ciot   iphone  camera  photography  https   t co qfvwbqwlnj"
"neutral","how to check weekly activity summary on  applewatch and  iphone https   t co a5st2nnp4a https   t co ygppeb7g1m"
"neutral","           tfbjp  teamfollowback  teamfollowwack  iphone  1000aday  teamhitfollow  follow  openfollow  mustfollow  ipod  hdyf    follo  mdo"
"positive","a new standard in aftermarket screen  introducing the fx5 range of  iphone screen  buy the iphone 8 plus version he  https   t co e8tjhiexxw"
"neutral","rt   korke   tweak   glacier    give the ios cc a transparent ui     no settings  condition     100  work    iphone 6s  ios 12 1 2   jailbr "
"neutral","the  hp 22 b013w all in one pc has everything you need in a pc  call   08140000114 https   t co bof4wsckzb  https   t co umzj3veeon"
"positive","jonagold apple      apples  apple  food  fruit  fruits  iphone  yummy  healthyfood  healthy  delicious  foodie  https   t co yudvdb3wgo"
"positive","rt  mmandmp pro  photo of me eating fish and chips with out a tripod for my phone  fish and chips at wetherspoons pub leicester  high cross "
"positive"," apple needs to step up its game when it comes to smart phones  companies that are no older than 8 yrs are making p  https   t co f6eehw8dq7"
"neutral","how many  faces  can you find   disneylandparis  disneyparks  disneylandpark  disney  pinocchio  restaurant  https   t co h7ckorb2x0"
"neutral","the back of pulau gaya from above               malaysiaairlines  flight  boeing737800  kktoklia  https   t co vpxshpdeoh"
"positive"," apple shows off  iphone xr xs portrait mode  depthcontrol with comical new  alejandro  ad   https   t co 9lv0io1exl"
"positive"," brand new release  safari  evolution   mac version  visit mac app store now to download for  free  click copy belo  https   t co qdvwpbcpnn"
"positive"," whatsapp business app expands to  iphone    applesupport https   t co tyrhhloas8"
"positive"," playbuzz  this groundbreaking application  document maker expects to bring controlling pdf master and document man  https   t co skj1qxpvor"
