"Response","tweets"
"neutral","health     iphone activity  thursday april 4 walking  running     steps distance  flights    climbed for erica n  f  https   t co cv0xcwwp9t"
"neutral","rt  aberglundartist  so many reflections in the spring            spring  water  countryside  country features  corn  iphone  goexplore  wa "
"neutral","health     iphone activity  thursday april 4 walking  running     steps distance  flights    climbed for erica n  f  https   t co 6309kwne6u"
"neutral","so many reflections in the spring            spring  water  countryside  country features  corn  iphone  goexplore  https   t co 5yyg8ksnbd"
"positive","can t trust anyone  now i have to set my airdrop settings to private   iphone  privacy  "
"positive","homekit deal  back again  sylvania color led lightstrip  18 99  extension kit  9 61  https   t co 0kh1piwczr  https   t co 5awboxqf1q"
"negative","iphone repair scam    two held for duping apple for rs 6 crore  face federal charges    chinese    iphone  https   t co emppi37vnx"
"neutral","you re my butterfly                                                      yeahbunnycase  yeahbunny  iphonecase  https   t co 4p8oaxxlcn"
"positive","  apple can t help   how a molecular biologist trained stay at home moms to recover lost  iphone photos  https   t co cm7qswb5t5"
"positive","i am thankful that despite the fact it s challenging working late on friday  amp  having to work the saturday before wr  https   t co pk6vc3uybh"
"positive","good  morning     supercalifragilisticexpialodocious  papi  tat  white  lion  me  armpits  abs  chest  iphone  https   t co uhxwhyh80c"
"neutral","i think that  blackberry will go out of business in the near future  people are hardly buying their smartphones  an  https   t co cbtqaqoeqx"
"positive","how do you use  ifttt to streamline life or work  i just downloaded and i m curious what others find most useful   https   t co 6czlrgnmuj"
"positive","rt  imexxproducts  mouse pad https   t co kgxjs5cdhd  imexx  new  florida  ventas  cables  audios  iphone  gadget  tech  peopleinspiredprod "
"positive","how to nickname a contact on  iphone or  ipad   full article here   gt  https   t co btcrcco4q0 https   t co cq6cke2ceq"
"positive","solid colors fashion uv nail polish gel iksmarkets   things and more shop   https   t co db18q66btq tag  follow and  https   t co 9wlymwkz6o"
"neutral","snooping  your  iphone keeps a detailed list of every location you frequent   here s how to delete your  history an  https   t co 2j1sj91qrh"
"positive","visit us today in  pittsburgh at  verizon  go wireless   2757 e  carson st  or 5889 forbes ave    iphone  https   t co tfsmeay6ye"
"positive","20  off storewide software w  code at  imyfone  all  imyfone  softwares  amp   apps on  cleaner   itunes repairer   https   t co kt83vec6q7"
"negative","with a bit of help from  sarah barbourr  canon  iphone https   t co x776ey3vir https   t co jciciev733"
"positive","free  today just for a limited time  added new temporarily free games apps gone free list for  apple  ios devices   https   t co 64ajsyxcqz"
"positive","mouse pad https   t co kgxjs5cdhd  imexx  new  florida  ventas  cables  audios  iphone  gadget  tech  https   t co 5wdh5hvgoz"
"positive"," 475  something smells funny https   t co dagatobmvw  apple   ios   ipad   iphone   mac   macos   podcast   https   t co xsk01ez2tu"
"neutral"," gifting247 193 fingers crossed     iphone  giveaway  ad"
"positive","all the new iphone xi  iphone xi max  amp  iphone xrs is come in late 2019           iphonexi  iphoneximax  iphonexrs  https   t co cvhqaisndx"
"negative","new iphone cases have arrived  get yours today for a crazy deal  supplies wont last long   https   t co tqpxemyuso  https   t co fevgiq6qcd"
"neutral","rt  annova canada  sony mdr as400ip black active headphones for iphone  ipad and ipod  buy now   https   t co ufrowv0ejm"
"negative","charging my laptop  watch  phone and shoes     who would have thought that i ll be charging my shoes             https   t co noegkqfsea"
"positive","good  better  best  never let it rest          govisionusa  antiglareglasses  govision  iphone  trend  look  smile  https   t co yzhb5tsjsz"
"positive","whitestone dome galaxy note 9 glass screen protector installation guide  screenprotector  screen  cracked  galaxy  https   t co c185frwzcw"
"positive"," apple can t help   how a molecular biologist trained stay at home moms to recover lost iphone photos   cbc news  https   t co 1q9wpxskpl"
"positive","the pc gaming show will return at e3 2019  april 3  2019 12 10 28 pm est     for the fifth straight year  the pc g  https   t co mm6ab1mlu5"
"neutral","if you have an  iphone you can use the native clips app to have some of the same features as  snapchat and  https   t co utuq84quaz"
"negative"," girlofthen what      you will miss your  iphone     you will switch back    "
"positive"," apple can t help   how a molecular biologist trained stay at home  moms to recover lost  iphone  photos   cbc news https   t co ibwbh4xklo"
"positive","do not miss a day of  golf history via the  thisdayingolf app   iphone  https   t co py2xalnrd3"
"positive","rt  wtznxtcom  forgot your  iphone password  here s how to restore access when you re locked out getting back into your  apple  iphone isn  "
"positive","forgot your  iphone password  here s how to restore access when you re locked out getting back into your  apple  https   t co riek0olrd7"
"positive","should you buy the latest  iphone or the  huaweip30pro   https   t co t5awsxqw00"
"neutral","https   t co byqairsyi0  hulkgameiphonewallpaperbackground  hulkgameiphonewallpaperdesktopimages  https   t co cmo7ebyzya"
"negative","smart cool hikone iphone repair shop at hikone city  shiga in japan  we can fix iphone issues  screen cracked batte  https   t co nrqf9uwnzj"
"positive","a bow for her bonnet  my yoshino cherry trees are in bloom and this random blossom  decide to land on  the deodar c  https   t co d4htl2mhqx"
"negative","rt  c joyce3183  leftover  raindrops on the bushes in the  backyard this chilly morning  wnep  amnewsers  iphone  nepa https   t co hiuvqcv "
"positive","bergooch  iphone x case  https   t co mtujlarbai  exotic https   t co wfltn9zfl2"
"negative"," apple should be ashamed on themselves after i watched this story on recovering photos from a water damaged  iphone  https   t co u6tjlecoty"
"positive","rt  yesicaneatcake  new thought i had      likeforlikes  likeforfollow  diabetes  love  cake  instagood  instamood  t1d  diabetic  apple  i "
"positive","new thought i had      likeforlikes  likeforfollow  diabetes  love  cake  instagood  instamood  t1d  diabetic  https   t co lhekhhkvwc"
"positive","rt  nradioapp  victor ruiz   nevermind   https   t co s9czrxol9v   techno and house online radio        https   t co qkn49i2nno    applemus "
"neutral","warren buffett doesn t use an  iphone  despite the fact that the firm he runs  berkshire hathaway  owns 5 5  of  https   t co 19atvsjx4h"
"positive","victor ruiz   nevermind   https   t co s9czrxol9v   techno and house online radio        https   t co qkn49i2nno  https   t co ny1yli9js2"
"negative"," apple s big  iphonexr sale is now on amazon  shop now or miss your chance  click here for details   https   t co saw5cj8yeq"
"negative","didn t know if you have custom dns resolver settings on  iphone  it conflicts with the app s connection at times  got it sorted now   "
"positive","drum cover saturday  simple creatures            saturday  music  positive  love  iphone  california  losangeles  https   t co lwi5xamxmt"
"positive","all hosed up  iphone x case  https   t co k9ujvxcpwx  art  exotic https   t co u4050lebp3"
"positive"," apple  iphone 7 32gb  unlocked  excellent  https   t co oa0ouj0kzz price   209 99 https   t co l9u8oyuuxe"
"negative","seriously  if this is a legit design for the  iphone with triple cameras then  thetileapp should sue apple for copy  https   t co 01rjjeuiim"
"neutral","hold your earphones and much more  https   t co kp4o0iljtv  phoneaccessories  iphone  accessories   smartphone  https   t co v5rbuvcxlg"
"positive","movie casting jobs in  atlanta https   t co tfm2vdl0cf  free on  iphone   android  and  amazon  appstore   casting  https   t co r1lkbstwqf"
"negative","anti wrinkle anti aging nourishing facial cream iksmarkets   things and more shop   https   t co db18q66btq tag  fo  https   t co tdpl0nruzt"
"positive","hey guys  kindle e reader https   t co rpgttodmsn  shopping  price  car  money  coupon  tv  video  aws  prime  https   t co edb1ggskkl"
"positive","we would like to wish you an amazing day  make every minute count  tls  today  iphone  accessories  news  life  https   t co jbvgcbzrnc"
"neutral","sony mdr as400ip black active headphones for iphone  ipad and ipod  buy now  https   t co sbonuskoli   sony  https   t co 5yknarxnkf"
"positive","hey guys  fire tablets https   t co 2ij5ontciy  shopping  price  money  coupon  car  tv  video  aws  prime  https   t co lag19je4fc"
"neutral","price drop   aqueduct 101  on sale for  iphone  ipad  2 99  gt  gt   1 99 https   t co uvou5ku1bz https   t co vn0djany4x"
"neutral","weekend recap   toddaostudios unveils phadr ios app for remote adr https   t co qgoxzd3jr3  proaudio  post  https   t co lzd4rw4jfk"
"positive"," backlightrepair on an  apple  iphone6s  now as good as new     diskdepot    dundee    standrews    apple    iphone  https   t co oxpqii0goa"
"neutral","nowplaying   potatohead people   carry on  https   t co 6xyfg2isbo   iphone app https   t co csmu9adcyx   peripouwebradio"
"neutral","the london bridge               shotoniphone  iphone  tourist  ghana  capecoast  street  architecture  bike  https   t co dbioynp59v"
"neutral","ibiza     sanantonio  ibiza  nofilter  iphone  iphonex  instagood  photooftheday  photography   sant antoni de port  https   t co dmwzyout4c"
"neutral","the london bridge               shotoniphone  iphone  tourist  ghana  capecoast  street  architecture  bike  https   t co jwqz3rqvh8"
"positive","rt  gbstechnologies  hey gamers  will you being subscribing to apple arcade this fall       https   t co fg1dtqaslr  https   t co wjtafuilnv"
"neutral","nowplaying   vanilla   origin  https   t co 6xyfg2isbo   iphone app https   t co csmu9adcyx   peripouwebradio"
"positive","rt  josecfigueira  check out my gig on fiverr  create unique phone cases  link  https   t co am6lcow3dk   https   t co 02wjkchzix"
"negative","the rock was starving so we fed it         paulvedierphotography  photography  shotoniphone  iphone  photoshoot  https   t co zbpmytzhwa"
"positive","what would happen if you gain so much weight and your phone doesn t recognize you anymore to unlock itself      all  https   t co yqydyc92to"
"positive","it s april 06  2019 at 09 46am  good morning unlocker  we unlock all  apple  iphone 7   7 plus  sprint  tmobile  att instantunlock  nfb"
"neutral","         oops i hv it       warren buffett doesn t use an  iphone  despite the fact that the firm he runs  berkshir  https   t co 5wjz4h3d1d"
"positive"," timesaving tips  quickly close your mobile apps   iphone   double click your home button  hold three fingers over  https   t co mkj1wcjfuu"
"negative","rt  androidauth  report  apple is now all in on creating own modems in pursuit of 5g iphone  read more  https   t co ira3y19vgq   technolog "
"neutral","nowplaying   somehowart   another day  featuring calmdown   https   t co 6xyfg2isbo   iphone app https   t co csmu9adcyx   peripouwebradio"
"positive","rt  sprintsaturday  it s not hump day   it s  sprint  saturday       free sprint drive for  10 a month  huge  sale  amp   savings on  apple  ip "
"positive","rt  1whirleddesign  chip says happy easter   chip the tooth cute imessage  stickers https   t co 1veyxiqch3      dentists  teeth  ios  indi "
"neutral","nowplaying   void pedal   parachute  https   t co 6xyfg2isbo   iphone app https   t co csmu9adcyx   peripouwebradio"
"negative","rt  udsteep  dear  iphone users have you ever suffered from this issue   iphone6  iphone6s  iphone7  iphone7plus  iphonese https   t co tae "
"positive","safely browse the web on the  iphone  completely anonymous  hide your bookmarks and browser history with a passcode  https   t co klq5f1xgrb"
"positive","apple s shocking new  iphone design makes sense https   t co 2aixeey4jz  apple  mobile  smartphone  patent  product  https   t co 4qc1ssvmiz"
"positive","hot body shapers vest iksmarkets   things and more shop   https   t co db18q66btq tag  follow and share   fashion  https   t co qzm7gus6ff"
"neutral","rt  humbleattitude1  butterflies pattern design  link   https   t co 1ylrg9ih7i store link is in my profile  butterfly  swallowtail  monarc "
"positive","ca dmv vehicle registration pay dmv fees   https   t co izgvi7kjrc free 2 day shipping have more time for  ktla spo  https   t co s7dhmrovjq"
"positive"," iphonecase  iphone  apple  smartphonecase fashion cute giraffe printed iphone case just  12 98 https   t co s0sai71pz4"
"positive","win an  iphone xs max   1 249      open worldwide        free  win  sweepstakes  giveaway  contest  sorteo  https   t co ctwl7w8pvi"
"positive","win an iphone xs 64gb   999      open worldwide      iphone  xs  iphonexs  win  free  sweepstakes  giveaway  https   t co gid9s7qbgo"
"positive","pink bright yellow girls   softball  otterbox  iphone  case w custom name  amp  jersey number https   t co ngdw61qwnh https   t co qvoow6hiv1"
"positive","my  apple  iphone is getting old and i am thinking to upgrade  twitterverse  please suggest and help me narrow down  https   t co ldcckiieih"
"positive","great new quadratic calc app https   t co l6xgk2ed4y  math  techtalk  iphone  ipad  mathchat  teachers  tech  https   t co b0djanefy0"
"positive","women s formal trousers   van heusen woman womens drop crotch pants this smart trouser by van heusen women  is perf  https   t co 80ccc9eptz"
"positive"," apple my first apple phone in 2019 is an iphone6 i really wish i can but the iphone 7plus let me just tell you som  https   t co mpmh1d46pl"
"positive","i have successfully integrated  ios  iphone into my long term  die hard  android life  my mission is to learn siri   https   t co qdwxgmiq5g"
"neutral","rt  alicomassi  latest iphone update totally f ed up my twitter  pics are not loading when connected to wi fi   apple  iphone  update"
"positive","rt  gbstechnologies  hey gamers  will you being subscribing to apple arcade this fall       https   t co rmnfhcq313   apple  applearcade  g "
"positive","rt  365mauritius  fire in the sky     goodmorning  morning  sunrise  mauritius  phoneography   iphone  deepintomauritius  sky  esteem  clou "
"positive","my only purpose for  ios  iphone is to learn siri  seeing ai  voiceover  amp  code swift  i just need to do a little mo  https   t co yrvlwthclb"
"positive","hey gamers  will you being subscribing to apple arcade this fall       https   t co rmnfhcq313   apple  applearcade  https   t co imlh8377qe"
"positive"," bible verse found with identity in christ daily by  roboticode for  android  iphone  kindle   dailyinspiration https   t co 5uslyklwuq"
"neutral","watched architects of control program one   mass control  amp  bites her nails  amp  was peeking out the window   iphone"
"positive","i finished the  big welding  task in big business deluxe for ios  https   t co ujksrkvbap  iphonegames  iphone  gameinsight"
"positive","check out our new  phone cases   we re adding at least 20 new designs a week     iphone  case  samsung  xddesigns  https   t co toy5lna3ng"
"neutral"," purple  mandala hippie pattern  iphone 4 case   https   t co grziukmybm"
"neutral","updated pythagorean calc  app https   t co jizwqhioai  math  techtalk  iphone  ipad  mathchat  teachers  tech  https   t co k0qlj1fcfr"
"positive","my coding in swift in  ios  iphone may be easy because i m a computer scientist of 35 years  that retired due to  blindness "
"neutral","friday evening      ireland  irish  spring  cavan  iphone https   t co 4zflshwtj6"
"positive","rt  gsbimagesmbusch  good morning from  hutchinson  island  florida  iphone  stormhour  weatherchannel  realsaltlife  spann  usasunrise htt "
"positive","frozen dragon gems   match 3   free    iphone ipad version available now to play for   free   in all app stores itu  https   t co gdrkcjdjxu"
"positive","car mount qi wireless charger iksmarkets   things and more shop   https   t co db18q66btq tag  follow and share   https   t co hnubx3rfsb"
"positive","best design iphone apple ever made           source  ijosh hoffmann            iphone  iphone4  iphone4s  https   t co f65xn4htsy"
"positive","test your love   https   t co tglgk6x1zm  itunes  love  apps  lovetest  funny  fun  iphone  ipad  newapp  ios  https   t co 6gus30akbq"
"negative","f5 acquires nginx for  670m to move into open source  multi cloud services  https   t co k3wpjpse2y   android  https   t co v2abwwabcu"
"positive"," ios  iphone  i m planning to start programming in swift very soon  swift development app already installed  now re  https   t co qsull6l0nd"
"negative","f5 acquires nginx for  670m to move into open source  multi cloud services  https   t co rypa1mxz48   smartphone  https   t co pkdqdsef8i"
"positive"," apple can t help   how a molecular biologist trained stay at home moms to recover lost  iphone photos   cbc news https   t co tzugo8q4lv"
"neutral","rt  gigi pqrs2928  today    iphone https   t co t5anezx6x8"
"negative","what fool designed the iphone so that i can no longer charge it  amp  put in headphones at the same time       iphone  apple  earphonejack"
"neutral","the collections   of him      unboxing   https   t co tiwoywx3ae   apple  appleproducts  ipad  iphone7plus  https   t co slbswjparq"
"negative","rt  suhrmesa   progressive affectation  https   t co plj25evhiu   bretweinstein  ericrweinstein  jordanbpeterson  benshapiro  rubinreport   "
"positive","rt  realgmurder   tim cook  apple  applemusic  i did this awhile back every body loved it hope you guys do as well maybe ya approve wink wi "
"negative"," progressive affectation  https   t co plj25evhiu   bretweinstein  ericrweinstein  jordanbpeterson  benshapiro  https   t co fotnnkkzst"
"negative","what i like about  photographs is that they  capture a moment that s gone  forever   impossible to  reproduce  https   t co zwilmy3q6k"
"negative","scam alert   lol  when you get a spoofed email not really from apple looking to have you  verify  your account info  https   t co 8pu0b3u3hv"
"positive","universal retro rechargeable wireless gamepad   gamingdevices  accessories  phone  android  iphone  phone https   t co d94n1we1jb"
"neutral","latest iphone update totally f ed up my twitter  pics are not loading when connected to wi fi   apple  iphone  update"
"positive"," birmingham  gasstbasin  city  boats  canal  narrowboat  reflections  iphone   birmingham  united kingdom https   t co 9mou5v2ryh"
"positive","dear  iphone users  you haven t entered into  haven yet   https   t co 77ydtkmpfx"
"positive","thick warm cashmere leggings iksmarkets   things and more shop   https   t co db18q66btq tag  follow and share   https   t co 3wxrr8gytc"
"positive","grab your old  new mobile from one of the most trusted old mobile seller  exchangemobi with emi option with bajaj f  https   t co jlofukx2hp"
"negative","rt  nameecase   make money not friend case        i5 i5s ise i6 i6s i6  i6s  i7 i8 ix      line  https   t co 8uriuh58nc      for more  ig "
"positive","snapshots from my  iphone a perfect view  me looking at you  my girl standing on a cliff maybe the scarborough bluf  https   t co vlfk5wcgc1"
"positive","reposting  capturewithphone    via  crowdfire  warm glow at the top of riffelsee   what do you think that pond wate  https   t co brno1culxq"
"positive"," bible verse found with words of jesus each day by  roboticode for  android  iphone  kindle   dailyinspiration https   t co 4be1tinjck"
"positive","my iphone says last week my screen time was down 5  for an average of 1 hour  39 minutes  the good news  my real li  https   t co u2xek1p5gg"
"positive","rt  qupsys  business email with google g suite   look professional signup here  https   t co 3liahourp2      gsuite  email  android   ios "
"negative","rt  keithjonescpa  investors are circling 3d systems corporation  nyse ddd   tetra tech  inc   nasdaqgs ttek   what do the numbers tell us  "
"negative","leftover  raindrops on the bushes in the  backyard this chilly morning  wnep  amnewsers  iphone  nepa https   t co hiuvqcv31q"
"positive","apple cant help  how a molecular biologist trained stay at home moms to recover lost  iphone photos https   t co n8o8bqfdaz  tweet4mee"
"positive","cool tool i just learned about  gt  how to use  iphone widgets  tech https   t co ndrftfvf0y"
"positive","latest macos update  10 14 4  provides support for  air quality index in maps for us  uk and india   macos  this is  https   t co w2tpgiizam"
"neutral","     sakura fireworks   cherry blossoms with the fireworks                2019            2019   japan  sakura  https   t co oe3qff4ndx"
"positive","blackpink right now   on screen  samsung android user off screen  iphone ios user  wkwkwkwkw haha love u girls    https   t co lhdajj3lnj"
"negative","investors are circling 3d systems corporation  nyse ddd   tetra tech  inc   nasdaqgs ttek   what do the numbers tel  https   t co wltydxkaun"
"neutral"," tim cook could apple bring the 12 month iphone subscription system to australia  apple  iphone"
"neutral"," wallpapers  homescreen  lockscreen    wallpaper    iphonexsmax     iphonexr     iphonexs     iphonex   iphone     https   t co be8l15ori1"
"neutral","rt  metrotravelnews   iphone users  did you know your camera has a built in qr code reader   so you can point the camera at the  qrcode car "
"positive","rt  ar72014   wallpaper  dear new followers  200 exclusive  wallpapers for your  iphonexs  iphonex  amp  for all other  iphone devices    from "
"positive","crystal angel butterfly fairy necklace iksmarkets   things and more shop   https   t co db18q66btq tag  follow and  https   t co olssjmxy0m"
"negative","call of duty black ops iii disponibile su mac  supporto a metal e 64 bit https   t co b2knesp9dt  pcexpander  https   t co 0q5kn3jewb"
"negative","do not know how to download apps over 150mb or 100mb without wifi on iphone  here s the trick for you    https   t co 9atejrupqa"
"neutral","price drop   starmap 3d  on sale for  iphone  ipad  1 99  gt  gt   0 99 https   t co xsoyv2g6et https   t co iqfpxo4vc9"
"positive","rt  mitulchowdhury5  welcome  walmart free gift card   https   t co 4r3hgevcim   https   t co zohqoaswnw  canada  https   t co 06x1xoq3ou"
"negative","rt  nigeriacircle  2 students scammed apple of  900k in fake iphone scheme  feds https   t co due0dkcy3d  attorneys  business  businessnews "
"negative","2 students scammed apple of  900k in fake iphone scheme  feds https   t co due0dkcy3d  attorneys  business  https   t co h8lrjsq3aa"
"positive","wts   iphone x 64gb unlocked  100  fully functional  tested  warranty  a class condition      stocks  iphone  https   t co rozlnehsjp"
"positive","   psa   a  message from  georgewbush    securedabag      inaguration  meme  comical  iphone  art  video  george  https   t co i24fxozroo"
"positive","welcome  walmart free gift card   https   t co kzjwrpyust   https   t co o7z30rhtxo  canada  usa  uk  business  https   t co kabjvmipxv"
"negative","our next campaign is launching on kickstarter in only 36 hours   check out this video for a sneak peak   https   t co cwzxwjno8r"
"positive"," iphone   send  amp  receive money through  imessage with  applepay on iphone        https   t co nijp3ir79f"
"positive","rt  dailybasik  us rule changes could mean more startups would need government approval to hire immigrants  https   t co d9aqapjvzo   techn "
"positive","us rule changes could mean more startups would need government approval to hire immigrants  https   t co d9aqapjvzo  https   t co 0kakkhzr01"
"negative","is there a bigger challenge in life      lifegoals  bigchallenge  iphone  lifeproblem  cartoon  comicbooks  https   t co zhagf26lyj"
"positive","make the most of your airpods   how to use airpods properly   https   t co n1zkoh1czj  airpods  airpod  airpods  airpods  apple  iphone"
"neutral","just left an iphone for repair  there should be an  iphone repair mode  where the technician could access features  https   t co bytow3sqar"
"neutral","caturday saturdays  mocha cat caf  in tokyo          caturday  cat  cats  cafe  saturday  catsofinstagram  tokyo  https   t co wh2mmqajcv"
"positive","tips  it s easy to use  airplay with a radio station s stream  but with a few steps  and an app or two  you can tur  https   t co cpo1y91yri"
"positive"," iphone  app  lottory  money i analized the past megamillions numbers  i found rule of the figures  check on iphone  https   t co zesht49xi7"
"neutral","i have a collection of my previously owned  iphone models  i take  em out for maintenance  amp  charging every 5 6 week  https   t co z2brlnf1ro"
"negative"," ios6  iphone  developer looking for  job  hiring  check  jobely https   t co eia7ofjgpr"
"positive","5 in 1 electric facial cleaning machine iksmarkets   things and more shop   https   t co db18q66btq tag  follow and  https   t co 3bp9xucm5z"
"positive","i am listening to  van morrison   these are the days   variety lovesongs        https   t co 3fmqyh1uoz  https   t co j34s643kys"
"neutral","need  phonecases design by ralufineart  check this out     phones  iphone  iphonexr  iphone8  iphonex  galaxys10  https   t co lkrmti5y3x"
"positive","rt  woodstockpro  rt rbguy5   abstract  polygon  shades of  purple     available now on  redbubble find your thing here  https   t co vvora "
"positive","apple iphone 2020  exclusive first look       like   share   comment          apple  iphone  appleiphone  iphonex  https   t co plmwfvajkm"
